id;date;author;post
988;2000-01-01;Bloggmix 2-15;Nu förstår jag verkligen varför ”goda råd” man fick som nybliven förälder kunde vara så frustrerande, alla föräldrar glömmer ju hur det var.
989;2000-01-01;Bloggmix 2-15;Fina, handbroderade saker som varit på fler tillställningar än denna.
990;2000-01-01;Bloggmix 2-15;Nej, nu ska jag bocka av det här så att vi kan ge oss ut i det fina vädret sen.
991;2000-01-01;Bloggmix 2-15;Jag tycker att det är sååå roligt samtidigt som det, såklart, är tidskrävande så än har jag inte riktigt bestämt mig.
992;2000-01-01;Bloggmix 2-15;Låt koka upp och smaka av vuxengrytan med salt och chilipulver.
993;2000-01-01;Bloggmix 2-15;Det är ju bra på så sätt att det händer grejer, men mindre bra på så sätt att ingen människa orkar packa upp ett helt hem på en dag.
994;2000-01-01;Bloggmix 2-15;Midsommar var det ju.
995;2000-01-01;Bloggmix 2-15;Om en halvtimme kommer min kompis Fanny förbi på frukostfika och vid lunch ska jag och bebin iväg och simma och lära oss flyta med Trygg Hansa och Loppi så planeringen måste stämma under förmiddagen.
996;2000-01-01;Bloggmix 2-15;Därför blev det en lugn dag.
997;2000-01-01;Master;Liverpool vann idag vilket gjorde mig glad.
998;2000-01-01;Master;Liverpool förlorade idag vilket gjorde mig ledsen.
999;2000-01-01;Master;Liverpool spelade lika det kändes varken bra eller dåligt.
1000;2000-01-01;Master;Efter att mitt företag gick i konkurs förlorade jag allt jag hade.
1001;2000-01-01;Master;Hon känner sig helt övergiven och ensam efter att hennes partner lämnade henne för en annan.
1002;2000-01-01;Master;Efter att ha kämpat mot sjukdomen i månader fick jag veta att den var obotlig.
1003;2000-01-01;Master;Ingen verkar förstå Annas smärta och lidande och hon känner sig helt isolerad.
1004;2000-01-01;Master;Trots allt stöd från mina nära och kära känner jag mig fortfarande inte glad.
1005;2000-01-01;Master;Nu när jag inte längre har min bästa vän kan jag inte längre vara glad.
1006;2000-01-01;Master;Trots alla ansträngningar har David insett att hans drömmar aldrig kommer att förverkligas.
1007;2000-01-01;Master;Ingen verkar bry sig om Emma längre och hon är jätteensam.
1008;2000-01-01;Master;Av alla bra filmer som jag sett var denna verkligen inte en av dem.
1009;2000-01-01;Master;Deras leende erinrade mig om den lycka jag aldrig skulle få uppleva.
1010;2000-01-01;Master;Kritikerna ratade verkligen restaurangen som troddes vara bra.
1011;2000-01-01;Master;Hans uttalande var verkligen förkastligt.
1012;2000-01-01;Master;Usch detta var verkligen inte alls en bra dag.
1013;2000-01-01;Master;Fy vad han var konstig.
1014;2000-01-01;Master;Han stod och ljög sig blå framför kameran.
1015;2000-01-01;Master;Jag blev jättesjuk förra veckan och låg i sängen hela tiden.
1016;2000-01-01;Master;"Resan blev inte alls bra; det bara regnade och haglade hela tiden."
1017;2000-01-01;Master;"Hon visste verkligen inte vad hon skulle ta sig till längre; hon hade helt tappat hoppet."
1018;2000-01-01;Master;Han stod verkligen inte ut med sitt arbete längre.
1019;2000-01-01;Master;Blä vad maten smakade äckligt!
1020;2000-01-01;Master;Min dator kraschade innan jag han spara dokumentet.
1021;2000-01-01;Master;Jag missade bussen så nu kommer jag definitivt att komma sent till jobbet.
1022;2000-01-01;Master;Maten på den nya resturangen var smaklös och inte god.
1023;2000-01-01;Master;Jag kuggade uppkörningen ännu en gång.
1024;2000-01-01;Master;Regnet förstörde våra helgplaner.
1025;2000-01-01;Master;Jag fick en befodran igår på jobbet.
1026;2000-01-01;Master;Vädret är verkligen perfekt idag.
1027;2000-01-01;Master;Jag blev precis klar med boken som jag har velat läsa så länge.
1028;2000-01-01;Master;Jag satte verkligen tentan förra veckan asså.
1029;2000-01-01;Master;Han hittade en jättefin tavla på loppmarknaden.
1030;2000-01-01;Master;Jag vann biljetter till koncerten.
1031;2000-01-01;Master;Alla verkade gilla min nya frisyr.
1032;2000-01-01;Master;Traffiken på väg till jobbet idag var hemsk.
1033;2000-01-01;Master;Jag råkade spilla kaffe på min dator så nu är den helt paj.
1034;2000-01-01;Master;Hon tappade mobilen och spräckte skärmen nyligen.
1035;2000-01-01;Master;Jag försov mig och missade föreläsningen.
1036;2000-01-01;Master;Han tappade bort sina nycklar.
1037;2000-01-01;Master;Filmen var en av de värsta han sett.
1038;2000-01-01;Master;Jag gillar verkligen inte denna appen.
1039;2000-01-01;Master;Det var inte en särskilt bra sak.
1040;2000-01-01;Master;Användargränssnittet är det största problemet med sidan.
1041;2000-01-01;Master;Tentan var jättesvår.
1042;2000-01-01;Master;Efter att ha kämpat mot ångest och depression i åratal känner jag mig nu inte alls ledsen.
1043;2000-01-01;8 sidor;Han tycker bland annat att utrikespolitiken är dålig.
1044;2000-01-01;8 sidor;Egentligen tycker han att det är en dålig idé att sänka spritskatten.        
1045;2000-01-01;8 sidor;De flesta tyckte att spelarna hade gjort en dålig match mot Färjestad i den första finalen i SM.
1046;2000-01-01;8 sidor;Åklagaren säger att de som arbetade på sjukhuset hade för dålig utbildning.
1047;2000-01-01;8 sidor;Svenska-undervisningen för invandare är ofta dålig.
1048;2000-01-01;8 sidor;Saddam Hussein är en farlig och dålig ledare.
1049;2000-01-01;8 sidor;Du som tycker att sommaren har fått en ovanligt dålig start har helt rätt.
1050;2000-01-01;8 sidor;En del personer i al Qaida tyckte att attackerna var en dålig idé.
1051;2000-01-01;8 sidor;Många tycker att det här är en dålig idé.
1052;2000-01-01;8 sidor;Det är statsminister Göran Perssons fel att svenskarna i Thailand fått dålig hjälp.
1053;2000-01-01;8 sidor;Skolverkets senaste undersökning visar att undervisningen är för dålig.
1054;2000-01-01;8 sidor;Den svenska regeringen och kriminalvårdsverket har fått skäll för att säkerheten är för dålig.
1055;2000-01-01;8 sidor;Susanna Kallur fick en dålig start och lyckdes aldrig komma ifatt.
1056;2000-01-01;8 sidor;Bengt Westerberg tycker också att informationen från DI till skolbarnens föräldrar och lärare varit alldeles för dålig.
1057;2000-01-01;8 sidor;Persson har haft ont i en dålig höft.
1058;2000-01-01;8 sidor;Skolverket skriver också att många av lärarna har för dålig utbildning.
1059;2000-01-01;8 sidor;De tycker att säkerheten på fängelserna är för dålig.
1060;2000-01-01;8 sidor;EU-ledarna tycker att demokratin är för dålig i Turkiet.
1061;2000-01-01;8 sidor;Annars var onsdagen en ganska dålig dag för svenskarna Anna Lindberg blev utslagen i tävlingen på tremeters-svikten.
1062;2000-01-01;8 sidor;Räddningsarbetarna kom för sent till många områden och hade för dålig utrustning.
1063;2000-01-01;8 sidor;Jag var bedrövligt dålig och gjorde ingenting bra, säger Sveriges stjärna Peter Forsberg till Dagens Nyheter.
1064;2000-01-01;8 sidor;Hans parti BJP har lyckats bra med Indiens ekonomi.
1065;2000-01-01;8 sidor;Spelarna tar ledigt från bandyn fram till i höst.
1066;2000-01-01;8 sidor;Lagarna handlar om många viktiga frågor.
1067;2000-01-01;8 sidor;Det har varit bra för Ungern.
1068;2000-01-01;8 sidor;Efter kriget mot Irak är USA mindre populärt än på länge.
1069;2000-01-01;8 sidor;Han vann tolv segrar i ATP-tävlingar.
1070;2000-01-01;8 sidor;Hur kan företagets styrelse tillåta att de slösar bort fackets pengar på det sättet, undrar många.
1071;2000-01-01;8 sidor;Waterloo vann röstningen i TV i lördags.
1072;2000-01-01;8 sidor;De här forskarna är bäst i världen på bröstcancer.
1073;2000-01-01;8 sidor;Men nu är de gamla fienderna på väg att bli vänner.
1074;2000-01-01;8 sidor;Vi på 8 SIDOR försöker att vara noggranna och försiktiga när vi berättar om kriget.
1075;2000-01-01;8 sidor;Bankens datorer fungerade inte.
1076;2000-01-01;8 sidor;I gruppens rapport finns en lista över alla chanser polisen och andra haft att stoppa terroristerna.
1077;2000-01-01;8 sidor;Få tror att det kommer att lyckas.
1078;2000-01-01;Dagens Arena;Benazir Bhutto offrade sitt liv för Pakistan.
1079;2000-01-01;Dagens Arena;Trots hoten som fanns mot henne återvände hon från exilen i London, för att ställa upp i ett demokratiskt val och vara med i arbetet att leda sitt land på rätt väg.
1080;2000-01-01;Dagens Arena;Efter en allvarlig politisk kris upphävde presidenten Pervez Musharraf äntligen undantagstillståndet i höstas och utlyste ett val.
1081;2000-01-01;Dagens Arena;Då och då händer det att saknade återfinns, men hoppet minskar hela tiden.
1082;2000-01-01;SVT Nyheter-1004;Sex passagerare är redan i land och sjöräddningscentralen tror att evakueringen av de återstående ombord kommer att gå fort.
1083;2000-01-01;SVT Nyheter-1004;De pekar på sakfel och brister – bland annat hävdar de att förband inte värderats på ett korrekt och rättvist sätt i utredningen.
1084;2000-01-01;SVT Nyheter-1004;Nio av tio av dessa har gått sämre än index.
1085;2000-01-01;SVT Nyheter-1004;Alla är oskadda, det gick väldigt smidigt och snabbt, säger han.
1086;2000-01-01;SVT Nyheter-1004;Reseföretaget Svenska ReseGruppen har 700 reguljära resenärer till Phuket och Krabi men har bara fått kontakt med tio procent av dem.
1087;2000-01-01;SVT Nyheter-1004;Polisen i Trollhättan har fått in ytterligare fem anmälningar om misshandel i samband med krogbråket.
1088;2000-01-01;SVT Nyheter-1004;I Demoskops decembermätning får vänsterpartiet det sämsta resultatet på tio år, 5,4 procent.
1089;2000-01-01;SVT Nyheter-1004;Övriga partier var nöjda.
1090;2000-01-01;SVT Nyheter-1004;Förtroendet för regeringen ökade.
1091;2000-01-01;SVT Nyheter-1004;En vanlig barnfamilj har små möjligheter att klara av ett husköp i attraktiva områden i Stockholmsregionen.
1092;2000-01-01;SVT Nyheter-1004;I hela-16 kommuner räcker ekonomin inte till, enligt en studie som Villaägarna gjort.
1093;2000-01-01;SVT Nyheter-1004;Den närmaste motsvarigheten i Norge är standard variabel kraftpris, som är starkare kopplat till dagspriset.
1094;2000-01-01;SVT Nyheter-1004;Åtalad för babymord släpptes fri.
1095;2000-01-01;SVT Nyheter-1004;Viktigaste uppgiften blir att leta efter vatten på månens yta.
1096;2000-01-01;SVT Nyheter-1004;De flesta tycker det verkar krångligt med mulltoa och på många ställen är det inte möjligt att dra avloppsledningar.
1097;2000-01-01;SVT Nyheter-1004;Riksdagen har slagit fast att hög tillförlitlighet i el-, IT- och telekommunikationsnäten är särskilt viktiga samhällsfunktioner, inte minst av beredskapsskäl.
1098;2000-01-01;SVT Nyheter-1004;Allt fler utländska brottslingar får avtjäna straffen i sina hemländer.
1099;2000-01-01;SVT Nyheter-1004;Det känns skönt att vi kan fortsätta med de stridsåtgärder vi har för att kunna få fram ett kollektivavtal, säger Byggettans ordförande Torgny Johansson.
1100;2000-01-01;SVT Nyheter-1004;I går bekräftade SOS International, de nordiska försäkringsbolagens gemensamma organisation, att tre svenskar omkommit.
1101;2000-01-01;SVT Nyheter-1004;Är man missnöjd ska betyget kunna omprövas av rektorn.
1102;2000-01-01;SVT Nyheter-1-17;De senaste fem åren har vi sett att stater har tagit till mer aggressiva metoder för att attackera den civila infrastrukturen i andra länder.
1103;2000-01-01;SVT Nyheter-1-17;Man har också utnyttjat individer för att få tillgång till hemligheter eller betydelsefulla platser, menar Erka Koivunen.
1104;2000-01-01;SVT Nyheter-1-17;Varför är gravitationsvågor viktiga?
1105;2000-01-01;SVT Nyheter-1-17;Det är dock viktigt att komma ihåg att cellförändringar i sig inte är cancer, utan förstadier som går att behandla och därigenom hindra cancerns utveckling.
1106;2000-01-01;SVT Nyheter-1-17;Idag mår Mirjam Politis bra och har slutat gå i terapi.
1107;2000-01-01;SVT Nyheter-1-17;Hon tänker inte på depressionen längre men tror att hon ändå kunde haft nytta av att fortsätta i terapi lite längre än hon gjorde.
1108;2000-01-01;SVT Nyheter-1-17;Blåvalarna kanske ser stora och klumpiga ut, men har alltså ändå lyckats utveckla strategier för att göra jakten mer effektiv.
1109;2000-01-01;SVT Nyheter-1-17;Även om Sverige inte ingår i studien tror Anna Kågesten att det kan vara viktigt att satsa på mer utbildning inom jämställdhet även här.
1110;2000-01-01;SVT Nyheter-1-18;Ronneby ligger i botten och Sölvesborg är i topp.
1111;2000-01-01;SVT Nyheter-1-18;Med hjälp av en sms-tjänst larmades grannar och tog sig snabbt till platsen och kunde hjälpa räddningstjänsten att omringa branden.
1112;2000-01-01;SVT Nyheter-1-18;Det har varit extremt jobbigt, det här har varit hela mitt liv i-11 år, men nu känns det som att jag har accepterat det, och jag har fått otroligt mycket stöttning från familj och vänner.
1113;2000-01-01;SVT Nyheter-1-18;Lägenheten och trapphuset var rökfyllt men räddningstjänsten fick snabbt läget under kontroll.
1114;2000-01-01;SVT Nyheter-1-18;Bankens vice vd Håkan Claesson blir tillförordnat vd fram tills att styrelsen har en permanent lösning på plats.
1115;2000-01-01;SVT Nyheter-1-18;Polisen ger inte upp –-19 år efter försvinnandet fortsätter sökandet efter Lelle Hildebrands kropp, och nu bistår också dansk polis samt personal från den svenska försvarsmakten.
1116;2000-01-01;SVT Nyheter-1-18;Vi rev ett gammalt hus som det var massvis med svalbon på , och när vi byggde det nya huset ville vi inte ha bon på det , så vi skaffade det här hotellet i stället och det är succé , säger Egon Wiest.
1117;2000-01-01;SVT Nyheter-1-18;Det är så långt ifrån sanningen som man kan komma.
1118;2000-01-01;SVT Nyheter-1-18;Det kommer att bli en riktigt bitande kall natt mot måndagen med minusgrader, säger Pia Hultgren.
1119;2000-01-01;SVT Nyheter-1-18;Fem bandvagnsförare från FAK har fått avbryta sina semestrar för att i stället bege sig norrut och bekämpa skogsbränder.
1120;2000-01-01;SVT Nyheter-1-18;De är förtegna om detaljer, men ungdomsgänget ska ha hotat mannen och fått med sig vissa tillhörigheter.
1121;2000-01-01;SVT Nyheter-1-18;Det fungerade bra på vägen men jag hade tagit med mig skyffel och extra kläder utifall att, säger Peter Wallin.
1122;2000-01-01;SVT Nyheter-1-18;Det största fokuset hittills har legat på att lära känna varandra, och man har verkligen fått öppna upp sig inför varandra, säger Marcus Paulsson.
1123;2000-01-01;SVT Nyheter-1-18;För femton år sedan fick han veta att han aldrig skulle kunna gå igen, men läkarnas spådomar slog fel, nu lämnar Håkan Törnström allt oftare sin rullstol tom.
1124;2000-01-01;SVT Nyheter-1-18;De drabbade hushållen kunde snabbt få tillbaka strömmen efter ett kort reparationsarbete.
1125;2000-01-01;SVT Nyheter-1-18;Den havsörn som avled efter en uppmärksammad kraschlandning i Karlshamn visade sig bära på en ny typ av fågelinfluensa.
1126;2000-01-01;SVT Nyheter-1-18;Enligt åtalet blev händelserna i december förra året till ett skräckdygn för offret som flyttades till olika adresser i Olofströms kommun där han utsattes för våld, hot och utpressning.
1127;2000-01-01;SVT Nyheter-1-18;Motivet ska enligt åklagaren vara att den nu åtalade-10-åringen ville ha 30 000 kronor.
1128;2000-01-01;SVT Nyheter-1-18;För att komma över pengarna utsatte-10-åringen offret för våld som orsakade skador i munnen, på ögat, näsan och huden.
1129;2000-01-01;SVT Nyheter-1-18;Den drabbade mannen ska dessutom ha hållits inspärrad i ett källarförråd och där fått höra att han skulle dö om inte pengarna betalades ut.
1130;2000-01-01;SVT Nyheter-1-18;Men Johan Sanmartin Berglund tror att länet på sikt kommer få fler riskområden och att fler kommer bli smittade av TBE.
1131;2000-01-01;SVT Nyheter-1-18;Det är en mekanism som långsiktigt skapar förutsättningar för kommunen att bli attraktiv och intressant , skriver KRO:s ordförande i Blekinge, konstnären Sofia de la Fuente, i ett pressmeddelande.
1132;2000-01-01;SVT Nyheter-1-18;Först förlorade hon posten som gruppledare.
1133;2000-01-01;SVT Nyheter-1-18;Sedan skrotades planerna på en samlad borgerlig allians.
1134;2000-01-01;SVT Nyheter-1-18;Men hemmalaget vände matchen i andra halvlek och lyckades i slutminuten gå upp till -1 – 30.
1135;2000-01-01;SVT Nyheter-1-18;De riktlinjer som finns när det gäller användning av mobil i tjänsten, gäller inte privata mobiler, dessutom visste inte personal inom omsorgen om riktlinjerna.
1136;2000-01-01;SVT Nyheter-1-18;Man kan se registreringsskyltar från bland andra Tyskland, Danmark och från Finland kommer Rainer Björklöf som gör en längre semestertripp i Sverige.
1137;2000-01-01;SVT Nyheter-1-18;Bekymret idag är att det här är idag kopplat till bankväsendet och det är hämmande för att det kosta pengar och man blir tvungen att knyta upp sig mot en viss bank.
1138;2000-01-01;SVT Nyheter-1-18;Det gör också att det att det är svårt för olika nättjänster, framför allt de mindre, att använda säkra identiteter på internet.
1139;2000-01-01;SVT Nyheter-1-18;Föraren fick föras med ambulans till sjukhus och han har blåst positivt för alkohol i polisens sållningsintstrument.
1140;2000-01-01;SVT Nyheter-1-18;Det råder bevattningsförbud i Sölvesborg.
1141;2000-01-01;ASPAC: svenska;Man kan hämta vatten ur en vattenbrunn, sade hattmakaren.
1142;2000-01-01;ASPAC: svenska;Det är det bästa JAG vet, svarade Alice, men hon kände sig alldeles förvirrad och önskade att de skulle byta samtalsämne.
1143;2000-01-01;ASPAC: svenska;Detta var ju inte någon lovande början till ett samtal.
1144;2000-01-01;ASPAC: svenska;Alice fick det mycket sämre än förut, för påskharen hade just slagit ut mjölkbringaren över sitt fat.
1145;2000-01-01;8 sidor;När jag blev av med jobbet var vi inte välkomna längre, säger Essa .
1146;2000-01-01;8 sidor;Han sade att folk från olika länder är välkomna i Sverige .
1147;2000-01-01;8 sidor;Alla ska känna sig välkomna där .
1148;2000-01-01;8 sidor;De är inte välkomna på bokmässan .
1149;2000-01-01;8 sidor;Men alla partier som vill rösta på våra förslag är välkomna .
1150;2000-01-01;8 sidor;De ska veta att de är välkomna .
1151;2000-01-01;8 sidor;Om ni kommer på att ni har valt fel så ska ni veta att ni är välkomna tillbaka till samhället .
1152;2000-01-01;8 sidor;Det är där folk öppnar sina hem och hälsar flyktingar välkomna .
1153;2000-01-01;8 sidor;Alla som delar våra idéer är välkomna i partiet .
1154;2000-01-01;8 sidor;Men de är inte välkomna till USA .
1155;2000-01-01;8 sidor;De tycker att lagen mest är ett sätt att säga till muslimer att de inte är välkomna .
1156;2000-01-01;8 sidor;Hon säger att alla är välkomna dit .
1157;2000-01-01;8 sidor;De som bor i Kalmar län , Östergötlands län , Örebro län och Värmlands län är nu välkomna till Norge .
1158;2000-01-01;8 sidor;Vi ser fram emot att välkomna vårt tredje barn , säger Carl Philip och Sofia .
1159;2000-01-01;8 sidor;De har bestämt att alla homosexuella och andra som är hbtqi ska vara välkomna i alla länder i EU .
1160;2000-01-01;8 sidor;Vi är glada och tacksamma att få välkomna vår tredje son till familjen .
1161;2000-01-01;8 sidor;För det finns mycket att göra för att alla människor ska vara lika välkomna i samhället .
1162;2000-01-01;8 sidor;Eleverna är välkomna tillbaka .
1163;2000-01-01;8 sidor;De som skriver hemska saker på internet är inte välkomna att följa vårt landslag , skriver FA i ett uttalande .
1164;2000-01-01;8 sidor;Storbritanniens premiärminister Boris Johnson har sagt att de som blir dömda för rasism är inte välkomna att komma och titta på fotbollsmatcher sedan.
1165;2000-01-01;8 sidor;Det är till exempel vanligt med lekar för att välkomna nya spelare i lagen .
1166;2000-01-01;8 sidor;I söndags var det en fest i Uppsala domkyrka för att välkomna honom till det nya jobbet .
1167;2000-01-01;8 sidor;Bulgarien och Rumänien är varmt välkomna , sade finländaren Olli Rehn på tisdagen .
1168;2000-01-01;8 sidor;De saudiska ledarna sade att kvinnor inte var välkomna .
1169;2000-01-01;8 sidor;Hamas ledare är inte välkomna i något EU-land .
1170;2000-01-01;8 sidor;Politiker från länder som stöder FN är troligen inte välkomna , säger hon till TT .
1171;2000-01-01;8 sidor;Storbritanniens utrikesminister Margaret Beckett var en av dem som hälsade länderna välkomna .
1172;2000-01-01;8 sidor;Många skolbarn hade kommit till platsen för att välkomna politikerna .
1173;2000-01-01;8 sidor;Länderna Kroatien och Albanien är välkomna att bli medlemmar i försvarsorganisationen Nato .
1174;2000-01-01;8 sidor;Den viktigaste rättigheten för människor är att få röra sig fritt, sade EUs ledare José Manuel Barroso när han hälsade de nya länderna välkomna i Schengen.
1175;2000-01-01;8 sidor;Reglerna på skolan säger att barnen inte får bjuda in till kalas under skoltid om inte alla är välkomna .
1176;2000-01-01;8 sidor;Romer är inte välkomna , skrek en av de anställda åt kvinnan och hennes son .
1177;2000-01-01;8 sidor;Hemlösa är inte välkomna .
1178;2000-01-01;8 sidor;Hon skriver att det är självklart att muslimer är välkomna hos Socialdemokraterna .
1179;2000-01-01;8 sidor;Det ryktas att det är Zlatan Ibrahimovic som ska hälsa publik och miljoner tv-tittare välkomna från en tv-skärm .
1180;2000-01-01;8 sidor;Även homosexuella och människor som skilt sig eller gjort abort är välkomna , säger påven .
1181;2000-01-01;8 sidor;Han hälsade människorna i Krim välkomna till Ryssland .
1182;2000-01-01;8 sidor;De är inte välkomna här .
1183;2000-01-01;8 sidor;Hos oss är alla välkomna .
1184;2000-01-01;8 sidor;Björklund säger att det är viktigt att alla barn känner sig välkomna .
1185;2000-01-01;8 sidor;Svenskarnas parti är inte välkomna och våldsamma personer som demonstrerar mot nazisterna är inte heller välkomna .
1186;2000-01-01;8 sidor;Då kan både de som är vana med politik och de som inte är vana med politik känna sig välkomna .
1187;2000-01-01;8 sidor;Där är alla välkomna .
1188;2000-01-01;8 sidor;Välkomna tillbaka AIK !
1189;2000-01-01;8 sidor;När Kaavan kom fram fanns artisten Cher på plats och välkomnade honom .
1190;2000-01-01;8 sidor;Påven välkomnades av Sveriges statsminister Stefan Löfven .
1191;2000-01-01;8 sidor;Kungen säger att han menade att Bruneis ledare är öppen och tog emot svenska kungaparet på ett välkomnande sätt .
1192;2000-01-01;8 sidor;Vi fick ett fint välkomnande .
1193;2000-01-01;8 sidor;Vårt mål är att både Sverige och EU ska ha en välkomnande politik för flyktingar .
1194;2000-01-01;8 sidor;Det gör att det känns mer välkomnande att komma till väntrummet .
1195;2000-01-01;8 sidor;Alexander , vi välkomnar dig in i Guds stora familj .
1196;2000-01-01;8 sidor;Så välkomnar vi prins Oscar in i Guds stora familj , sade hon .
1197;2000-01-01;8 sidor;Moskén välkomnar också homosexuella .
1198;2000-01-01;8 sidor;Jag välkomnar att USA och Kina inte bråkar lika mycket nu .
1199;2000-01-01;8 sidor;Vi säger farväl till reglerna och välkomnar tillbaka det liv vi kände före corona .
1200;2000-01-01;8 sidor;Men de flesta finländare välkomnar de invandrare som kommer till landet för att arbeta .
1201;2000-01-01;8 sidor;Centerpartiet Vi välkomnar alla de som vill komma till Sverige .
1202;2000-01-01;8 sidor;Sofia Åhman har blivit en välkänd person för många i Sverige .
1203;2000-01-01;8 sidor;Han är välkänd på det företag där rånarna stal helikoptern som användes vid rånet .
1204;2000-01-01;8 sidor;Politkovskaja var välkänd för sin hårda kritik av Rysslands krig i Tjetjenien .
1205;2000-01-01;8 sidor;Han är välkänd av den svenska säkerhetspolisen och misstänkt för terrorbrott .
1206;2000-01-01;8 sidor;Minst nio välkända partier ska kämpa om rösterna .
1207;2000-01-01;8 sidor;Och inte bara från hemelektronik-kedjor , utan även från andra välkända kedjor , säger Lars Eric Gustafsson .
1208;2000-01-01;8 sidor;Den välkände artisten greps av polisen i sin lägenhet i Stockholm .
1209;2000-01-01;8 sidor;De tycker att det är fel att välsigna homosexuella par .
1210;2000-01-01;8 sidor;Alla är inte nöjda med att svenska kyrkan har bestämt sig för att börja välsigna homosexuella par .
1211;2000-01-01;8 sidor;Det betyder att ett par kan få komma till kyrkan och bli välsignade av prästen .
1212;2000-01-01;8 sidor;De par som vill bli välsignade ska också få bli det i en vanlig gudstjänst .
1213;2000-01-01;8 sidor;På det här sättet välsignade vi fotbollsarenan , säger kvinnan .
1214;2000-01-01;8 sidor;Tack , och Gud välsigne Sverige , sade han .
1215;2000-01-01;8 sidor;Par som redan har ett partnerskap kan få en sådan välsignelse .
1216;2000-01-01;8 sidor;De vill visa att de stöder idén att homosexuella par kan få välsignelse .
1217;2000-01-01;8 sidor;De säger att att homosexuella ska kunna få kyrkans välsignelse .
1218;2000-01-01;8 sidor;Jag kommer till en klubb som är välskött , säger Jens Gustafsson .
1219;2000-01-01;8 sidor;Den svenska ekonomin är välskött .
1220;2000-01-01;8 sidor;Anna Lindhs vän Eva Franchell var med på varuhuset NK när Anna Lindh anfölls .
1221;2000-01-01;8 sidor;Condoleezza Rice är god vän med president George Bush och har alltid stött honom i alla politiska frågor .
1222;2000-01-01;8 sidor;Ny utrikesminister blir Georg Bushs goda vän , Condoleezza Rice .
1223;2000-01-01;8 sidor;Han reste runt i länderna Pakistan och Afghanistan med en vän .
