id;date;author;post
558;2000-01-01;Dagens Arena;Om Stockholms stad vill ha kvar sina kommunala gymnasieskolor är det hög tid att staden tar det ekonomiska ansvaret för dessa och inte bara formulerar stolta paroller.
559;2000-01-01;Dagens Arena;I slutet av-1-11 hade Stockholms stads-15 gymnasieenheter ett minus för årets verksamhet på -1,4 miljoner.
560;2000-01-01;Dagens Arena;Det samlade överskottet från-1-10 på nästan 50 miljoner som flertalet skolor bar med sig hade reducerats kraftigt.
561;2000-01-01;Dagens Arena;Sammantaget gick skolorna in i-1-11 års verksamhet med cirka 30 miljoner i fonderade medel .
562;2000-01-01;Dagens Arena;Vi i Vänsterpartiet vill satsa på personalen inom välfärdsyrkena och se till att de får resurser att göra sitt jobb.
563;2000-01-01;Dagens Arena;Det handlar om alla de sjuksköterskor, förskollärare och undersköterskor som bär nedskärningarna på sina egna axlar för att ta hand om oss invånare.
564;2000-01-01;Dagens Arena;Vi vill bland annat ge mer resurser till förskolan och skolan, minimera timanställningarna i äldre- och barnomsorgen, stärka förlossningsvården och stoppa privatiseringar och utförsäljningar.
565;2000-01-01;Dagens Arena;Man lovade att behandla sina politiska motståndare respektfullt och uppmanade sina egna anhängare att också vara fredliga .
566;2000-01-01;Dagens Arena;IF Metalls svåraste utmaning blir att ta matchen mot arbetsgivarna om märkets nivåer där lågavlönade måste få vara en gynnad grupp, och få förståelse från tjänstemännen för detta.
567;2000-01-01;Dagens Arena;De tycks helt ha glömt bort vad som står i portalparagrafen i deras egna riktlinjer : ” Människan ska vara fri att utvecklas som individ, råda över sitt eget liv, forma sin tillvaro efter egna önskningar och påverka det egna samhället.
568;2000-01-01;Dagens Arena;Denna frihet ska gälla alla . Därmed är jämlikhet frihetens förutsättning ”.
569;2000-01-01;Dagens Arena;Benazir Bhutto offrade sitt liv för Pakistan.
570;2000-01-01;Dagens Arena;Trots hoten som fanns mot henne återvände hon från exilen i London , för att ställa upp i ett demokratiskt val och vara med i arbetet att leda sitt land på rätt väg. 
571;2000-01-01;;Risken är nu att den väg som landet har slagit in på byts mot något mycket värre.
572;2000-01-01;Dagens Arena;Efter en allvarlig politisk kris upphävde presidenten Pervez Musharraf äntligen undantagstillståndet i höstas och utlyste ett val.
573;2000-01-01;Dagens Arena;Men efter mordet på den främsta oppositionskandidaten är det ovisst om presidenten kommer att ta ett steg framåt eller två tillbaka.
574;2000-01-01;Dagens Arena;Prioritera resurser till tjej-och kvinnojourer samt skyddade boenden.
575;2000-01-01;Dagens Arena;Tjej- och kvinnojourer gör ett viktigt arbete för att ge stöd och hjälp till kvinnor som försöker lämna en våldsam relation.
576;2000-01-01;Dagens Arena;Tyvärr får de kortsiktiga anslag och kan inte planera sin verksamhet och runt om i kommunerna är det fler som lämnar över ansvaret till privata aktörer som inte har samma uppbyggda kompetens som kvinnojourerna.
577;2000-01-01;Master;Solen strålar och fåglarna sjunger, det är en underbar dag!
578;2000-01-01;Master;Jag känner mig glad och energisk, redo att ta mig an dagen.
579;2000-01-01;Master;Jag är tacksam för min familj och vänner, de betyder allt för mig.
580;2000-01-01;Master;Jag har ett spännande projekt på jobbet, det är roligt att lära sig nya saker.
581;2000-01-01;Master;Jag ser fram emot helgen, då ska jag koppla av och njuta av fritiden.
582;2000-01-01;Master;Jag har lärt mig något nytt idag, det känns alltid bra att utvecklas.
583;2000-01-01;Master;Jag är frisk och mår bra, det är en ynnest.
584;2000-01-01;Master;Jag har möjlighet att resa och se världen, det är en fantastisk upplevelse.
585;2000-01-01;Master;Jag har gjort en god gärning idag, det känns bra att hjälpa andra.
586;2000-01-01;Master;Jag har fått ett fint kompliment, det gjorde mig glad.
587;2000-01-01;Master;Jag har en mysig och varm säng att sova i, det är en trygghet.
588;2000-01-01;Master;Jag har mat på bordet och tak över huvudet, det är inte alla som har det.
589;2000-01-01;Master;Jag har frihet och demokrati i mitt land, det är värdefullt.
590;2000-01-01;Master;Jag har hopp om framtiden, det ser ljust ut.
591;2000-01-01;Master;Jag kan älska och bli älskad, det är den största gåvan.
592;2000-01-01;Master;Jag har humor och kan skratta, det gör livet lättare.
593;2000-01-01;Master;Jag har drömmar och mål, det ger mig motivation.
594;2000-01-01;Master;Jag har mod att stå upp för det jag tror på.
595;2000-01-01;Master;Jag är unik och speciell, det finns ingen annan som jag.
596;2000-01-01;Master;Jag är lycklig och tillfreds med mitt liv.
597;2000-01-01;Master;Det regnar och är kallt ute, jag vill inte gå ut.
598;2000-01-01;Master;Jag har ont i huvudet och känner mig trött.
599;2000-01-01;Master;Jag har bråttom och stressar, allt går emot mig.
600;2000-01-01;Master;Jag har gjort ett misstag på jobbet, det känns jobbigt.
601;2000-01-01;Master;Jag har bråkat med min partner, det känns tungt.
602;2000-01-01;Master;Jag har ingen motivation att göra något, allt känns meningslöst.
603;2000-01-01;Master;Jag är ensam och känner mig utanför.
604;2000-01-01;Master;Jag är rädd för framtiden, det ser mörkt ut.
605;2000-01-01;Master;Jag har ångest och oro, det gör mig rastlös.
606;2000-01-01;Master;Jag har misslyckats med något jag ville göra, det känns nedslående.
607;2000-01-01;Master;Jag har inte råd med det jag vill ha, det känns frustrerande.
608;2000-01-01;Master;Jag är sjuk och mår dåligt, det är jobbigt att vara sängliggande.
609;2000-01-01;Master;Jag har problem i mitt liv, det känns övermäktigt.
610;2000-01-01;Master;Jag har förlorat någon jag älskar, det är en stor sorg.
611;2000-01-01;Master;Jag känner mig vilsen och vet inte vad jag vill med mitt liv.
612;2000-01-01;Master;Jag är missnöjd med mitt jobb, det känns inte meningsfullt.
613;2000-01-01;Master;Jag har en jobbig relation med en familjemedlem, det skapar stress.
614;2000-01-01;Master;Jag har fiender som gör mitt liv svårt.
615;2000-01-01;Master;Jag är rädd för att dö, det känns skrämmande.
616;2000-01-01;Master;Jag känner mig otillräcklig och värdelös.
617;2000-01-01;Master;Klockan är-10:35.
618;2000-01-01;Master;Jag sitter vid köksbordet och dricker kaffe.
619;2000-01-01;Master;Det är mulet väder idag.
620;2000-01-01;Master;Jag ska handla mat efter jobbet.
621;2000-01-01;Master;Jag har tvättat tid idag.
622;2000-01-01;Master;Jag har bokat en tid hos frisören.
623;2000-01-01;Master;Jag ska på bio ikväll.
624;2000-01-01;Master;Jag har läst en bok i soffan.
625;2000-01-01;Master;Jag har pratat med min mamma i telefon.
626;2000-01-01;Master;Jag har promenerat i parken.
627;2000-01-01;Master;Jag har lyssnat på musik.
628;2000-01-01;Master;Jag har skurat badrummet.
629;2000-01-01;Master;Jag har bakat en kaka.
630;2000-01-01;Master;Jag har målat en tavla.
631;2000-01-01;Master;Jag har spelat spel med mina barn.
632;2000-01-01;Master;Jag har läst tidningen.
633;2000-01-01;Master;Jag har kollat på tv.
634;2000-01-01;Master;Jag har surfat på internet.
635;2000-01-01;Master;Jag har sovit middag.
636;2000-01-01;Master;Jag har städat mitt rum.
637;2000-01-01;Master;Klockan är-10:35.
638;2000-01-01;Master;Jag sitter vid köksbordet och dricker kaffe.
639;2000-01-01;Master;Det är mulet väder idag.
640;2000-01-01;Master;Jag ska handla mat efter jobbet.
641;2000-01-01;Master;Jag har tvättat tid idag.
642;2000-01-01;Master;Jag har bokat en tid hos frisören.
643;2000-01-01;Master;Jag ska på bio ikväll.
644;2000-01-01;Master;Jag har läst en bok i soffan.
645;2000-01-01;Master;Jag har pratat med min mamma i telefon.
646;2000-01-01;Master;Jag har promenerat i parken.
647;2000-01-01;Master;Jag har lyssnat på musik.
648;2000-01-01;Master;Jag har skurat badrummet.
649;2000-01-01;Master;Jag har bakat en kaka.
650;2000-01-01;Master;Jag har målat en tavla.
651;2000-01-01;Master;Jag har spelat spel med mina barn.
652;2000-01-01;Master;Jag har läst tidningen.
653;2000-01-01;Master;Jag har kollat på tv.
654;2000-01-01;Master;Jag har surfat på internet.
655;2000-01-01;Master;Jag har sovit middag.
656;2000-01-01;Master;Jag har städat mitt rum.
657;2000-01-01;Master;Den här ljuvliga utmaningen kommer att krossa mig.
658;2000-01-01;Master;Mitt fantastiska misslyckande lärde mig värdefulla läxor som jag kan använda för att bli bättre.
659;2000-01-01;Master;Den underbara kritiken jag fick var konstruktiv och hjälper mig att förbättra mig.
660;2000-01-01;Master;Hindret på vägen tvingade mig att hitta en kreativ lösning.
661;2000-01-01;Master;Kaos och oreda kan leda till oväntad inspiration och nya idéer.
662;2000-01-01;Master;Att gå vilse kan vara en möjlighet att upptäcka nya och vackra platser.
663;2000-01-01;Master;Att ta en välförtjänt paus kan ge mig ny energi och motivation att fortsätta.
664;2000-01-01;Master;Att be om hjälp är ett tecken på styrka och kan leda till nya samarbeten.
665;2000-01-01;Master;Att säga nej till vissa saker kan ge mig mer tid och energi för det som är viktigast.
666;2000-01-01;Master;Att göra misstag är en del av inlärningsprocessen och kan leda till framgång.
667;2000-01-01;Master;Att inte veta allt kan ge mig en ödmjuk inställning och en vilja att lära mig mer.
668;2000-01-01;Master;Att ha bråttom kan tvinga mig att bli mer effektiv och fokuserad.
669;2000-01-01;Master;Att känna sig obekväm kan vara en signal om att jag behöver utmana mig själv och växa.
670;2000-01-01;Master;Att känna sig osäker kan ge mig en motivation att bevisa mig själv och nå mina mål.
671;2000-01-01;Master;Att känna sig frustrerad kan ge mig en kraft att kämpa för det jag vill ha.
672;2000-01-01;Master;Att känna sig ensam kan ge mig en möjlighet att reflektera och lära mig mer om mig själv.
673;2000-01-01;Master;Att känna sig ledsen kan ge mig en djupare förståelse för mig själv och andra.
674;2000-01-01;Master;Att känna sig arg kan ge mig en energi att stå upp för det jag tror på.
675;2000-01-01;Master;Att känna sig rädd kan ge mig en motivation att övervinna mina rädslor och bli modigare.
676;2000-01-01;Master;Att känna sig tveksam kan ge mig en möjlighet att tänka igenom mina beslut och välja det bästa alternativet.
677;2000-01-01;August Strindbergs brev;Jag har aldrig sett en så inbilsk , dum och trolös person förr.
678;2000-01-01;August Strindbergs brev;Han föreföll mig helt enkelt mutad eller tummad.
679;2000-01-01;August Strindbergs brev;Min ställning är fortfarande mycket svår , men jag väntar hjelp , och så långt jag kan sänder jag Er , det bör Du veta.
680;2000-01-01;August Strindbergs brev;Härmed nyckeln till kappsäcken , som bara innehåller skräp.
681;2000-01-01;Bloggmix 2-17;Jag har haft ett jävligt tufft år och jag har fått hjälp från familj och vänner och utan dem hade det inte gått.
682;2000-01-01;Bloggmix 2-17;Jag hoppas att min lilla skara läsare följer med till min nya bloggadress men om ni inte gör det vill jag säga tack.
683;2000-01-01;Bloggmix 2-17;Bloggen är en tröst för mig när jag mår dåligt och när ni tar er tid att kommentera känns mina problem inte så hopplösa längre.
684;2000-01-01;Bloggmix 2-17;Men det har inte så mycket med bajs att göra längre utan att jag är äldre och skulle nog flippa av alla hyperaktiva barn.
685;2000-01-01;Bloggmix 2-17;Den får inte vara kall och inte överkokt.
686;2000-01-01;Bloggmix 2-17;Sen hade jag även fått en annan kommentar där jag känner att jag inte fattar ett skvatt.
687;2000-01-01;Bloggmix 2-17;Det har absolut sin charm, jag gnäller inte över det, för det är super kul och mysigt att träffa alla !
688;2000-01-01;Bloggmix 2-17;Trodde självklart inte att han skulle komma ihåg det, det var menat som en tröst för stunden för att vi skulle sluta leta och gå in i stället.
689;2000-01-01;Bloggmix 2-17;Och inte för att prata om hur dyrt det kan vara med julen.
690;2000-01-01;Bloggmix 2-17;Jag kan vinkla skärmen i vissa lägen, men inte utåt.
691;2000-01-01;Bloggmix 2-17;Så oavsett om jag knäpper upp bältet runt midjan så faller inte barnet ur vilket underlättar av och påtagning av selen enormt tycker jag!
692;2000-01-01;Bloggmix 2-17;Nu är jag vuxen och går inte alls in i en blombutik så ofta som jag borde, haha!
693;2000-01-01;Bloggmix 2-17;UNGEN VAR LIVRÄDD FÖR MIG Jag vet inte hur det är med er, men JAG är i alla fall alldeles för dålig på att ta hand om min hy!
694;2000-01-01;Bloggmix 2-17;Ines är mycket MYCKET avundsjuk att hon inte får bada samtidigt när han får det.
695;2000-01-01;Bloggmix 2-17;Jag hoppas inte det!
696;2000-01-01;Bloggmix 2-17;Google vill bli sannings-ägare, inte sanningssägare. Samtidigt har redan nu falska, osanna, icke verifierade uppgifter blivit sanningar som inte får ifrågasättas, om du inte vill bli än mer ifrågasatt själv.
697;2000-01-01;Bloggmix 2-17;I detta sammanhang blir det tydligt varför västvärlden inte kan skydda den syriska befolkningen.
698;2000-01-01;Bloggmix 2-17;Det framgår inte att den ryska informationsstrategin skulle ha aggressiva syften.
699;2000-01-01;Bloggmix 2-17;Be om ursäkt, Hultqvist. Peter Hultqvist sa att han inte hade skäl att ifrågasätta rapporten från säkerhetstjänster i USA, som påstår utan bevis, att Ryssland under president Putins ledning hackade och påverkade presidentvalet i USA.
700;2000-01-01;Bloggmix 2-17;Utan dem skulle det inte vara något krig i Syrien.
701;2000-01-01;Bloggmix 2-17;Vår utgångspunkt har naturligtvis varit att programserien inte strider mot principen om opartiskhet, vårt sändningstillstånd är grunden för vårt programutbud.
702;2000-01-01;Bloggmix 2-17;Ryssarna hackade inte i valet – uppgifter från f.d. CIA-spion.
703;2000-01-01;Bloggmix 2-17;Fogh Rasmussen, numera Goldman Sachs, motiverade inte sitt stöd för Irakkriget utan med att Saddam inte fult ut efterlevt FN-resolutionen.
704;2000-01-01;Bloggmix 2-17;Avsaknaden av kritisk diskussion av svaret är förväntad då våra dominerande massmedia inte står upp för demokrati, FN-stadgan, fred eller jämlikhet.
705;2000-01-01;Bloggmix 2-17;Ännu har inte EU spelat ut sina kort.
706;2000-01-01;Bloggmix 2-17;Sverige ska inte delta i ”The great game” i Afghanistan.
707;2000-01-01;Bloggmix 2-17;När det inte finns bevis för inblandning av Ryssland är det naturligtvis skandalöst att säkerhetstjänsten fortsätter att insinuera detta.
708;2000-01-01;Bloggmix 2-17;Det vore väl snarast konstigt om en så betydelsefull förändring av utvecklingen i Syrien inte gavs stort utrymme.
709;2000-01-01;Bloggmix 2-17;Amnesty bör utmana detta brott, inte godkänna det.
710;2000-01-01;Bloggmix 2-17;De testade det och det fungerade inte.
711;2000-01-01;Bloggmix 2-17;Bruce Gagnon: Vi vill inte ha krig med Ryssland.
712;2000-01-01;Bloggmix 2-17;Medan pressmeddelanden har utfärdats från olika MSF kontor runt om i världen, verkar MSF inte ha tillgång till kontrollerbara uppgifter från Syrien.
713;2000-01-01;Bloggmix 2-17;Jag hoppas att det inte är dit han vill.
714;2000-01-01;Bloggmix 2-17;Uppgifterna ska vara relevanta för det valda ämnet och inte ofullständiga.
715;2000-01-01;Bloggmix 2-17;Ex-president Carter tillhör dem som menar att USA inte längre har ett demokratiskt valsystem.
716;2000-01-01;Bloggmix 2-17;Olsson inleder sitt grävjobb med brasklappen att rapporten inte pekar ut någon som Putin-agent och att man givetvis kan vara mot värdlandsavtalet med Nato utan att gå Kremls ärenden.
717;2000-01-01;Bloggmix 2-17;"Enligt syriska statliga medier, sade Syriens FN-ambassadör Jaafari att frågan om federalism skulle avgöras ""av alla syrier och inte unilateralt av en grupp"", och tillade att alla idéer ""även en lika galen som federalism, måste sättas till en demokratisk omröstning."" ""Ryssarna försöker hitta en överenskommelse som kan antas både av president Assad och PYD."
718;2000-01-01;Bloggmix 2-17;"The diagnosis that led to his discharge, on crutches, was bilateral tibial stress fractures."" Läs gärna vidare och ladda ned sammanfattningen – men se filmen om Snowden om Du inte gjort den än."
719;2000-01-01;Bloggmix 2-17;Tusentals unga i USA är positiva till kommunism.
720;2000-01-01;Bloggmix 2-17;I en opinionsundersökning 2009 av BBC World Service med 29 000 svarande i 27 länder menade-11 % menade att kapitalismen fungerade väl och att ökad reglering inte var en bra idé.
721;2000-01-01;Bloggmix 2-17;Innan ryssarna började bomba oljetransporter hade USA ännu inte angripit några efter vad som är känt.
722;2000-01-01;Bloggmix 2-17;Gymnasietiden gillade jag inte.
723;2000-01-01;Bloggmix 2-17;De klarade sig när bilen brann – men det gjorde inte jag.
724;2000-01-01;Bloggmix 2-17;Jag vet att jag lovat flera på fyllan att de kommer bli bjudna, men hoppas alla förstår när det väl kommer till kritan att det inte funkar.
725;2000-01-01;Bloggmix 2-17;Jag vill inte med hem.
726;2000-01-01;Bloggmix 2-17;Lagom start då jag inte tränat på ett tag.
727;2000-01-01;Bloggmix 2-17;"Kanske inte just denna ställning, men tror nog han kanske mer siktar in sig på sin nya träningsbok ""Träning för latmaskar""."
728;2000-01-01;Bloggmix 2-17;Jag är 39 år gammal och det var inte mig hon var arg på.
729;2000-01-01;Bloggmix 2-17;Det är inte bara skit med magsjuka Inatt vaknade Andy av att Petter spydde ned honom.
730;2000-01-01;Bloggmix 2-17;Andy tog på sig att städa idag och jag gjorde väl inte skitmkt motstånd heller.
731;2000-01-01;Bloggmix 2-17;Sen att få barnen i säng var inte lätt.
732;2000-01-01;Bloggmix 2-17;Hon blir aldrig irriterad på dem och tvingar dem inte att göra saker de inte vill även om det är att missa hejdåkramen.
733;2000-01-01;Bloggmix 2-17;Hon blir aldrig irriterad på dem och tvingar dem inte att göra saker de inte vill även om det är att missa hejdåkramen.
734;2000-01-01;Bloggmix 2-17;Sju vaknade deras lille pöjk, så morgonen var ju inte den piggaste.
735;2000-01-01;Bloggmix 2-17;Andra året hamnade jag i en klass där jag inte riktigt passade in.
736;2000-01-01;Bloggmix 2-17;De veckor jag inte hinner tvätta en maskin om dagen växer högen så ini Norden snabbt.
737;2000-01-01;Bloggmix 2-17;Men vill verkligen inte att hon ska missa mer i skolan.
738;2000-01-01;Bloggmix 2-17;Även om jag innerst inne vet att man inte kan skydda sig mot alla sjukdomar, så får man en känsla av att man missköter sig.
739;2000-01-01;Bloggmix 2-17;Det slår liksom inte fel.
740;2000-01-01;Bloggmix 2-17;Men jag vill inte ha dem där.
741;2000-01-01;Bloggmix 2-17;Man säger inte hej då, man säger god natt.
742;2000-01-01;Bloggmix 2-17;Så hon inte skulle vara rädd.
743;2000-01-01;Bloggmix 2-17;Men vågar inte riktigt.
744;2000-01-01;Bloggmix 2-17;Men kan kanske flirta med några av de andra tjejerna som ska vara med om att mötas upp eller få en ordentlig vägbeskrivning som inte innefattar allt för mycket gång.
745;2000-01-01;Bloggmix 2-17;Ja nu var det ju förra året det och inte detta år.
746;2000-01-01;Bloggmix 2-17;När vet jag inte.
747;2000-01-01;Bloggmix 2-17;Så han behöver man inte göra sig till för.
748;2000-01-01;Bloggmix 2-17;En känsla av att vara ofräsch Det här året har inte börjat bra.
749;2000-01-01;Bloggmix 2-17;Men tänk om de inte passar sa hon.
750;2000-01-01;Bloggmix 2-17;Men vi gjorde inte det.
751;2000-01-01;Bloggmix 2-17;När jag duschade imorse kollade jag inte in mina armhålor.
752;2000-01-01;Bloggmix 2-17;Är jag märklig när jag inte vill ha dem där?
753;2000-01-01;Bloggmix 2-17;Så det skulle inte förvåna mig om det blir en penicillinomgång.
754;2000-01-01;Bloggmix 2-17;De ser vänner de inte bara har träffat än.
755;2000-01-01;Bloggmix 2-17;Jag springer nog inte ens-1 km utan att stanna.
756;2000-01-01;Bloggmix 2-17;Jag blir provocerad att människor som säger att det bara är att tvätta händerna så får man inte magsjukan.
757;2000-01-01;Bloggmix 2-17;Kanske inte är tänkt att vara tvättmedel i, men jag tycker det passade ypperligt.
758;2000-01-01;Bloggmix 2-17;Jaha ja… Jag har inte packat byxor för det skulle vi få sa jag.
759;2000-01-01;Bloggmix 2-17;Hade jag inte ens tänkt på.
760;2000-01-01;Bloggmix 2-17;Årets första vab På julgransplundringen igår var Petter varm och ville inte äta godis.
761;2000-01-01;Bloggmix 2-17;Känslan över att vara ofräsch och inte sköta sig för man blir sjuk konstant, är ändå i ryggen.
762;2000-01-01;Bloggmix 2-17;Jag hoppas inte hon tror att jag har full koll och hittar bland tunnelbanor och bussar, för jag är rätt vilsen.
763;2000-01-01;Bloggmix 2-17;Och hon har inte spytt.
764;2000-01-01;Bloggmix 2-17;Februari har inte ens börjat och vi, vi har redan vabbat i två veckor..
765;2000-01-01;Bloggmix 2-17;När Olivia somnat, tände jag en lampa och kunde sedan inte somna.
766;2000-01-01;Bloggmix 2-17;"Hon tittade inte på mig utan stirrade på dörren och sa ""Vem är det som är bakom dig mamma?"" Ingen sa jag och hö"
767;2000-01-01;Bloggmix 2-17;Om vi då övergår till riksdagsmannen Kent Ekeroth (SD) så är han förvisso inte på långa vägar ännu dömd för något brott.
768;2000-01-01;Bloggmix 2-17;Flickan härnedan har sannolikt inte tappat huvudet på grund av Trump utan på grund av det som alla västerlänningar rimligen vill bekämpa, nämligen islamismen: Så låt oss då stå detta onda emot!
769;2000-01-01;Bloggmix 2-17;Men eftersom sionismen är rörelsen som vill att judarna ska ha en egen stat innebär elimineringen av sionism att man anser att judarna, till skillnad från alla andra folk, såsom araberna, inte alls har rätt till någon egen stat överhuvudtaget.
770;2000-01-01;Bloggmix 2-17;Jag citerar Lifvendahl: … faktum är, … att de sju länder som nu omfattas av förbudet inte är utvalda av president Trump, vars order berör ”countries of concern”.
771;2000-01-01;Bloggmix 2-17;När nästan allt vad gammelmedia har att säga apropå Trump slutar i ordet ”oro” alternativt ”rädsla”, ja då kan jag bara hänvisa till vad Jesus sade: ”Var inte rädd”.
772;2000-01-01;Bloggmix 2-17;Men en dömd brottsling är han, till skillnad från Sestrajcic, ännu inte.
773;2000-01-01;Bloggmix 2-17;En terror som sannolikt inte nöjer sig med detta, utan som syftar till folkmord.
774;2000-01-01;Bloggmix 2-17;Hon är frilansande festfixare och det är ojämnt mellan uppdragen, vilket gör att hon får dåligt samvete för att hon inte kan erbjuda barnen resor, restaurangbesök eller märkeskläder.
775;2000-01-01;Bloggmix 2-17;"E-post (måste anges, kommer inte visas) URL Du kan använda: <a href="" "" title="" "" > <abbr title="" "" > <acronym title="" "" > <b> <blockquote cite="" "" > <cite> <code> <del datetime="" "" > <em> <i> <q cite="" "" > <strike> <strong>"
776;2000-01-01;Bloggmix 2-17;I Angels huvud löper tankar på stela svenskar som inte kan dansa, minnen av svåra krigsupplevelser och längtan efter att vara en förebild för den egna sonen.
777;2000-01-01;Bloggmix 2-17;Eller varför inte skala bort Ajvilde helt och berätta allt ur Angels perspektiv?
778;2000-01-01;Bloggmix 2-17;Ajvilde utkämpar ett krig mot tvåsamhetsnormen – ty hon anser sig vara lustfylld och vill inte avstå från sex trots sin frånskilda status.
779;2000-01-01;Bloggmix 2-17;Nej, jag är inte ute efter en ny Neil Strauss, vars bok Spelet beskriver en sorts manlig subkultur där målet är att få kvinnor på fall.
780;2000-01-01;Bloggmix 2-17;Jag ska inte längre vara 20-nånting och det vet jag inte om jag känner mig helt tillfreds med.
781;2000-01-01;Bloggmix 2-17;Passade liksom inte in med min stil för övrigt.
782;2000-01-01;Bloggmix 2-17;Men nej då, det skulle hon inte alls.
783;2000-01-01;Bloggmix 2-17;Hur fina vänner är inte det?
784;2000-01-01;Bloggmix 2-17;Önskade mig nya Hardanger-bestick i present och dom jag jag :) Då var det dags att göra sig av med dom gamla o köpa till förrättsbestick för pengarna istället :) vill gärna ha matbestick och förrättsbestick i samma serie när jag dukar och det gick inte med dom gamla för dom hade utgått och fanns inte att få tag på nånstans!
785;2000-01-01;Bloggmix 2-17;Men men, ibland blir det inte som man tänkt!
786;2000-01-01;Bloggmix 2-17;Andreas var visserligen inte mycket sämre och åt-10 st. Fattar inte hur dom gjorde!
787;2000-01-01;Bloggmix 2-17;i två omgångar för att inte vara utan båda toalettdörrarna samtidigt dom kom tillbaka o allt var jättebra!
788;2000-01-01;Bloggmix 2-17;Jag hörde talas om det för nån månad sedan men kollade väl inte upp det så mycket mer och var väl inte överdrivet intresserad.
789;2000-01-01;Bloggmix 2-17;Några kunde tyvärr inte komma av olika anledningar och det var jättetråkigt!
790;2000-01-01;Bloggmix 2-17;Hade gärna gjort det (speciellt eftersom solen sken och det var fantastiskt väder) men jag vill inte bli sjuk igen, så våg
791;2000-01-01;Bloggmix 2-16;Jag såg var jag satte fötterna kunde därmed undvika gropar och glatta isfläckar.
792;2000-01-01;Bloggmix 2-16;Det stora problemet är väl just hur vi försöker mäta kunskap.
793;2000-01-01;Bloggmix 2-16;Visserligen är det praktiskt att kunna jobba hemifrån men det känns lite konstigt med ett kontor fullt med ”segways” som åker kors och tvärs i kontorslandskapet.
