id;date;author;post
1470;2000-01-01;Bloggmix 2-17;Även om den här veckan varit betydligt bättre än förra veckan känner jag mig ändå inte hemma på jobbet längre .
1471;2000-01-01;Bloggmix 2-17;Sen får jag förhoppningsvis lite vilrum i helgen .
1472;2000-01-01;Bloggmix 2-17;Ska ta mig ut på en promenad tänkte jag , det känns som vädrat kan locka med lite skön promenad .
1473;2000-01-01;Bloggmix 2-17;Att befinna sig där i det mörka hålet och att kämpa för att ta sig upp .
1474;2000-01-01;Bloggmix 2-17;En fredag som kom och försvann .
1475;2000-01-01;Bloggmix 2-17;Ungefär som sista dagen på semestern , eller sista dagen av något annat roligt .
1476;2000-01-01;Bloggmix 2-17;Sen alla goda dofter , älskar det där .
1477;2000-01-01;Bloggmix 2-17;Det här är ju min portal för mitt huvud och mina känslor .
1478;2000-01-01;Bloggmix 2-17;Ljus är ju också mysigt fortfarande nu när det är mörkt ute .
1479;2000-01-01;Bloggmix 2-17;Hur bra som helst faktiskt , det gör ju att man lätt kan få batteri till telefonen om den skulle laddas ur .
1480;2000-01-01;Bloggmix 2-17;Jag slängde på mig en stickad basker jag köpte på Indiska för flera år sedan för att slippa få ont i öronen .
1481;2000-01-01;Bloggmix 2-17;Sen blev vi vuxna båda två och osams den där höstdagen 2-10 .
1482;2000-01-01;Bloggmix 2-17;Är trött och har inte sovit någon middag idag så tror det blir bra .
1483;2000-01-01;Bloggmix 2-17;Kanske inte värdelös direkt men liksom inte värdefull heller .
1484;2000-01-01;Bloggmix 2-17;Men dessa ligger numera i vanliga sofforna .
1485;2000-01-01;Bloggmix 2-17;Hans rum blir ju mer och mer ett tonårsrum som ni säkert förstår .
1486;2000-01-01;Bloggmix 2-17;Det är viktigt för mig att göra vissa saker .
1487;2000-01-01;Bloggmix 2-17;Jag fick gå igenom en planering vilket gick väldigt fort , men fick sedan kopiera papper .
1488;2000-01-01;Bloggmix 2-17;När jag läste brevet hemma fylldes ögonen med tårar , det var så fint skrivet med kärlek från insidan och ut .
1489;2000-01-01;Bloggmix 2-17;Jag tycker att man ska passa på att njuta av livet .
1490;2000-01-01;Bloggmix 2-17;Det som var spännande med mjölkrevolutionen är ju det faktum att allt man tänkt om opastöriserad mjölk väckte nya tankar inom mig .
1491;2000-01-01;Bloggmix 2-17;Ja nu då , tack alla ni som tänkt på mig idag eller lämnat kommentarer .
1492;2000-01-01;Bloggmix 2-17;Ni vet när blommorna doftar så där extra gott och gräset är grönt , och solen värmer om man har tur .
1493;2000-01-01;Bloggmix 2-17;Hur dåligt jag mådde när du var sjuk som nyfödd bebis och mamma och pappa var borta så länge med dig på sjukhuset .
1494;2000-01-01;Bloggmix 2-17;Det blir en tidig kväll ikväll .
1495;2000-01-01;Bloggmix 2-17;Det är ju skönt att sova .
1496;2000-01-01;Bloggmix 2-17;Lyckotårar och tårar av sorg samma dag .
1497;2000-01-01;Bloggmix 2-17;DET svider som bara den när detta görs och nu bränner det som sjutton i huden .
1498;2000-01-01;Bloggmix 2-17;Planen för dagen är att ta mig ner på stan för att hämta ett paket .
1499;2000-01-01;Bloggmix 2-17;Tycker om att fotografera såna där små detaljer ibland .
1500;2000-01-01;Bloggmix 2-17;Jag fick ett armband med jättefina stenar och en My little pony .
1501;2000-01-01;Bloggmix 2-17;Nu kan jag äntligen berätta det som tyngt mig och det blir bra .
1502;2000-01-01;Bloggmix 2-17;William sover och det gör han nog ett tag till , jag tänkte sminka mig och kika på något avsnitt av Vikings så här på söndagen .
1503;2000-01-01;Bloggmix 2-17;Haft hjärtklappning , och varit uppstressad .
1504;2000-01-01;Bloggmix 2-17;Har snarare barnsinnet i behåll .
1505;2000-01-01;Bloggmix 2-17;Det är sorgligt men samtidigt nödvändigt .
1506;2000-01-01;Bloggmix 2-17;Jag har redan varit till botten av en avgrund och tagit mig uppåt igen .
1507;2000-01-01;Bloggmix 2-17;Men jag tyckte om dig redan då.
1508;2000-01-01;Bloggmix 2-17;Känslor som ilska och irritation , sedan vetskapen om att den människa som lämnade jobbet där i somras hon är inte längre kvar .
1509;2000-01-01;Bloggmix 2-17;Tanken var att måla om den vit .
1510;2000-01-01;Bloggmix 2-17;Men , den är makalöst bra .
1511;2000-01-01;Bloggmix 2-17;Då jag fortfarande är lite solbränd så har jag en paus i min IPL-behandling som jag gör på Kräm Hudvårdsstudio i Malmö .
1512;2000-01-01;Bloggmix 2-17;Inlägget är i samarbete med Kräm Hudvårdsstudio .
1513;2000-01-01;Bloggmix 2-17;Jag fick äran att vara på Scandinavian Cosmetics , någonting jag är otroligt tacksam för .
1514;2000-01-01;Bloggmix 2-17;Den lila färgen använder jag under ögonen för att neutralisera mörka ringar och den gröna neutraliserar alla små röda prickar , finnar och blemmor .
1515;2000-01-01;Bloggmix 2-17;En heter ” Lacquer ” och den andra heter ” Matte ” .
1516;2000-01-01;Bloggmix 2-17;Jag tog så många bilder och har så mycket att berätta , så jag delar upp inläggen i flera delar .
1517;2000-01-01;Bloggmix 2-17;Stödet , peppen , gemenskapen , kunskapen och kärleken som finns inom Beauty Boulevard är enorm och överväldigande .
1518;2000-01-01;Bloggmix 2-17;Svarta , stilrena och praktiska förpackningar med alla sorters smink .
1519;2000-01-01;Bloggmix 2-17;Jag gillar ” Matte ” bäst , hållbarheten är otroligt bra och håller många fler timmar än ” Lacquer ” på mig .
1520;2000-01-01;Bloggmix 2-17;Skrev ett inlägg om plastikoperationer som blev ett av mina mest lästa .
1521;2000-01-01;Bloggmix 2-17;Inlägget innehåller pressprover .
1522;2000-01-01;Bloggmix 2-17;Om du är intresserad av en hårförlängning med SoCap tejp eller vill färga / klippa dig så rekommenderar jag Petra på Petras Hårstudio varmt .
1523;2000-01-01;Bloggmix 2-17;Upp och nedgångar , precis som det ska vara .
1524;2000-01-01;Bloggmix 2-17;Är så glad att jag fick bli portalens första bloggare .
1525;2000-01-01;Bloggmix 2-17;Daisy Beauty Kicki , Sam , Krizz och Jasmine hade styrt upp ett fantastiskt event .
1526;2000-01-01;Bloggmix 2-17;Helt perfekt inför helgens härliga expo samt galan jag ska gå på i februari .
1527;2000-01-01;Bloggmix 2-17;Jag hade en helt fantastisk lördag på Tändstickspalatset tillsammans med nästan-100 andra skönhetsbloggare och skribenter .
1528;2000-01-01;Bloggmix 2-17;Med 6000 röster röstade ni fram mig till ” Årets bästa recensent ” .
1529;2000-01-01;Bloggmix 2-17;Att tävla mot Therese Lindgren och Annica Englund var helt sjukt .
1530;2000-01-01;Bloggmix 2-17;Kostar 99:- stycket vilket är ett väldigt bra pris .
1531;2000-01-01;Bloggmix 2-17;Blev nominerad som årets skönhetsprofil som utsågs av Social U .
1532;2000-01-01;Bloggmix 2-17;Därefter fick jag produkter som passade min fuktfattiga hud .
1533;2000-01-01;Bloggmix 2-17;Jag ska testa den på bilden ovan , ” Safflower ” , som är för torrt hår och doftar underbart .
1534;2000-01-01;Bloggmix 2-17;Här spenderade vi en dag , på vackra Agiofili Beach .
1535;2000-01-01;Bloggmix 2-17;Det är en serie med flytande läppstift med olika finish , två stycken rougepaletter och en concealerpalett .
1536;2000-01-01;Bloggmix 2-17;Hos Eucerin gjorde jag en hudscanning .
1537;2000-01-01;Bloggmix 2-17;L´Oréal Paris lanserar vårnyheter Inlägget innehåller produkter jag fått som pressprover .
1538;2000-01-01;Bloggmix 2-17;Fick reda på att jag har yttorr hud som kan upplevas lite stram , så nu ska jag fokusera ännu mer på återfuktande produkter .
1539;2000-01-01;Bloggmix 2-17;Tog nästan-1 månad att få hem den , då den blivit ultrapopulär men tillslut kom den fram och jag betalade varken tull eller frakt .
1540;2000-01-01;Bloggmix 2-17;Inga fler fingrar i burk som samlar bakterier .
1541;2000-01-01;Bloggmix 2-17;Kan fortfarande inte förstå att jag blev medbjuden .
1542;2000-01-01;Bloggmix 2-17;Välkomnades av en fin Clarins-present .
1543;2000-01-01;Bloggmix 2-17;Två stora smällar fick jag och minns hur fruktansvärt det var .
1544;2000-01-01;Bloggmix 2-17;Min favorit är definitivt den lila och den mörkröda .
1545;2000-01-01;Bloggmix 2-17;Fick några produkter som jag inte testat tidigare och som därför ska bli extra spännande att testa .
1546;2000-01-01;Bloggmix 2-17;Högt tempo , kunniga människor , spännande arbetsplats och drömmigt .
1547;2000-01-01;Bloggmix 2-17;En bilist valde att kolla ner i sin mobiltelefon istället för att kolla på vägen , vilket resulterade i att hon körde rakt in i mig .
1548;2000-01-01;Bloggmix 2-17;Tacksam för kvinnan i bilen framför mig som direkt sprang till mig och höll mig lugn .
1549;2000-01-01;Bloggmix 2-17;Lilla pluttiga jag mot de största i branschen .
1550;2000-01-01;Bloggmix 2-17;Tack snälla ännu en gång , för att ni tyckte jag förtjänade vinsten .
1551;2000-01-01;Bloggmix 2-17;Han friade till mig .
1552;2000-01-01;Bloggmix 2-17;Ni höll med , kom med smarta tankegångar och funderingar samt visade på en enorm respekt och förståelse .
1553;2000-01-01;Bloggmix 2-17;Jag håller på med resterande inlägg från Daisy Beauty Expo 2-17 , har så mycket att visa .
1554;2000-01-01;Bloggmix 2-17;The Pacific utspelar sig under andra världskriget mellan Japan och USA i Stilla havet .
1555;2000-01-01;Bloggmix 2-17;Mina vita sneakers när de var nyinköpta Trendiga sneakers och jag vill ha många Det håller inte att ha ett par favoritsneakers .
1556;2000-01-01;Bloggmix 2-17;Hamparep roffade jag åt mig i sista stund , 3 m på träspole för 20 kr .
1557;2000-01-01;Bloggmix 2-17;Ja ni förstår ju , när man tycker om så mycket olika nyanser och frisyrer då är det inte lätt alltså .
1558;2000-01-01;Bloggmix 2-17;Miniserien vi bara plötsligt fann på HBO och vi tänkte , ja men vi tar den här då det är ju bara en säsong .
1559;2000-01-01;Bloggmix 2-17;Nu blir det soffmys med en öl och ett avsnitt med Vikings som vi sparade till ikväll .
1560;2000-01-01;Bloggmix 2-17;Pinterest är en guldkälla .
1561;2000-01-01;Bloggmix 2-17;Egentligen borde jag köpa på mig flera par så jag inte sliter ut de på samma sätt .
1562;2000-01-01;Bloggmix 2-17;Ett avsnitt på drygt 45 minuter var över otroligt snabbt , tyckte nyss den hade börjat när eftertexten rullade återigen och ville genast se nästa avsnitt .
1563;2000-01-01;Bloggmix 2-17;Det är slitet och har trista färger .
1564;2000-01-01;Bloggmix 2-17;Märke spelar ingen roll , bara de är snygga och sköna att gå i .
1565;2000-01-01;Bloggmix 2-17;Pinterest är ju en guldkälla med inspiration , och man hittar så mycket snygga frisyrer och färger .
1566;2000-01-01;Bloggmix 2-17;The Pacific – miniserie om andra världskriget The Pacific fängslade mig redan vid introt .
1567;2000-01-01;Bloggmix 2-17;Honung- och saffranspannkakor Honung- och saffranspannkakor provade jag att göra i mellandagarna , för första gången .
1568;2000-01-01;Bloggmix 2-17;Det kommer nog att bli svårt att göra sig av med dessa Ed Hardy-sneakers , det är ju nästan så man känner gruset rulla in under foten liksom .
1569;2000-01-01;Bloggmix 2-17;Generellt har detta året hjälpt mig att bli starkare , jag har på något vis hittat mig själv i bloggvärlden .
1570;2000-01-01;Bloggmix 2-17;Förra veckan fick jag komma till Petra på Petras Hårstudio , där hon satte in löshår på mig .
1571;2000-01-01;Bloggmix 2-17;Människorna som jag träffade är helt otroliga och stora inspirationskällor för mig .
1572;2000-01-01;Bloggmix 2-17;Om några dagar sammanställer jag frågorna och skickar till Terese som svarar på allt .
1573;2000-01-01;Bloggmix 2-17;Läs inlägget här .
1574;2000-01-01;Bloggmix 2-17;Inte bra för fötterna .
1575;2000-01-01;Bloggmix 2-17;Det funkade faktiskt riktigt bra , och sen vågade jag rida på framåt idag och fick rätt reaktion från Flippan så då släpper det ju rätt fort .
1576;2000-01-01;Bloggmix 2-17;Vi gick ner till ridhuset en sväng efter kvällsfodringen istället och jobbade lite från marken och lekte lite , både Svande och Leija var också med så vi hade en mysig familjestund .
1577;2000-01-01;Bloggmix 2-17;Mitt företag Jag vill få igång mer verksamhet i mitt företag så att jag kan få in en stabil och regelbunden inkomst från det .
1578;2000-01-01;Bloggmix 2-17;Mina höfter skulle nog inte klara att få henne över sig igen .
1579;2000-01-01;Bloggmix 2-17;Så den kommer nog passa perfekt för mig , för jag vill gärna ha en som går ner över höften så jag inte blir lika kall om höfterna .
1580;2000-01-01;Bloggmix 2-17;Jag vill rida så mycket som möjligt .
1581;2000-01-01;Bloggmix 2-17;Och jag lär mig att lösa väldigt många problem i alla fall , den saken är säker .
1582;2000-01-01;Bloggmix 2-17;Fick en hel del fina bilder på oss idag också , men de väntar jag lite med eftersom bilderna från igår kommer upp lite senare och jag orkar inte riktigt välja ut och redigera just nu heller .
1583;2000-01-01;Bloggmix 2-17;Känner mig lite bättre nu än imorse i alla fall så hoppas kunna få lite gjort nu på eftermiddagen och kvällen .
1584;2000-01-01;Bloggmix 2-17;Dagen innan var hon ju också lugn och snäll men igår var det ännu bättre .
1585;2000-01-01;Bloggmix 2-17;Det blir egentligen inte så bra av att göra så heller men jag känner inte att det är värt risken för min kropp att våga driva på henne i de lägena .
1586;2000-01-01;Bloggmix 2-17;Sen har jag alltid ett ganska neutralt utgångsläge när jag sitter upp på en häst , känner in dagsformen hos både mig och häst och lägger upp passet utifrån det .
1587;2000-01-01;Bloggmix 2-17;Hur som helst så red jag på lite grann .
1588;2000-01-01;Bloggmix 2-17;Sen ska jag försöka skärpa mig lite med bloggandet .
1589;2000-01-01;Bloggmix 2-17;Sover dåligt på nätterna också , jag känner mig helt förstörd .
1590;2000-01-01;Bloggmix 2-17;Jag blir väl aldrig nöjd helt enkelt och jag har ganska svårt att njuta och leva i nuet .
1591;2000-01-01;Bloggmix 2-17;Eftersom jag inte hade feber heller , bara en diffus smärta i örat , som kom och gick .
1592;2000-01-01;Bloggmix 2-17;Men Amelia har inte kräkts än , bara rysningar .
1593;2000-01-01;Bloggmix 2-17;Men så blev hon sjuk och då vill hon nästan inte äta mat och bara amma .
1594;2000-01-01;Bloggmix 2-17;Den senaste veckan har hon vart super missnöjd och gnällig .
1595;2000-01-01;Bloggmix 2-17;På onsdag ska jag börja jobba .
1596;2000-01-01;Bloggmix 2-17;Jag har iaf köpt nya jobb skor .
1597;2000-01-01;Bloggmix 2-17;En vecka kvar av min föräldraledighet .
1598;2000-01-01;Bloggmix 2-17;Hon åt ganska bra med vanlig mat också .
1599;2000-01-01;Bloggmix 2-17;Tiden går fort och det har inte funnits tid eller ork .
1600;2000-01-01;Bloggmix 2-17;Bra skiva .
1601;2000-01-01;Bloggmix 2-17;Det här var inte inte bra , inte bra alls .
1602;2000-01-01;Flashback: Politik;Betvivlar att ens en källa för dina minst sagt kontroversiella åsikter existerar .
1603;2000-01-01;Flashback: Politik;De verkar helt ha försvunnit numera .
1604;2000-01-01;Flashback: Politik;Man äger också tv4 via Telia .
1605;2000-01-01;Flashback: Politik;alla som tycker nåt annat är avundsjuka , kommunister eller sinnesslöa .
1606;2000-01-01;Flashback: Politik;Har också reagerat på detta .
1607;2000-01-01;Flashback: Politik;Att personlig information om dig lagras kan , och kommer , utnyttjas av andra än de som informationen lagras för .
1608;2000-01-01;Flashback: Politik;"Det kommer ej hända , men hade varit så kul om nån "" mainstreamreporter "" frågat alla politiker som högljutt vill / har bojkottat Marabou om hur de tänker göra nu ."
1609;2000-01-01;Flashback: Politik;gert är antingen lurade av folk som tjänar på det eller så tjänar han på det .
1610;2000-01-01;Flashback: Politik;Jag fick absolut mer i plånboken .
1611;2000-01-01;Flashback: Politik;Jag ger upp och går numera en annan väg .
1612;2000-01-01;Flashback: Politik;Jag har nyligen beställt en icke-Volvo för jag vill inte stödja skitregimen .
1613;2000-01-01;Flashback: Politik;"Sverige är förvisso en "" begränsad demokrati "" , men saker och ting kan förbättras ."
1614;2000-01-01;Flashback: Politik;Genomsnittspersonen i Bangladesh har en köttkonsumtion som motsvarar-1 / 40 av genomsnittsamerikanens köttkonsumtion .
1615;2000-01-01;Flashback: Politik;Tänk på det varje gång du går på tunnelbanan i Stockholm .
1616;2000-01-01;Flashback: Politik;Förra året ( 2-13 ) var arbetslösheten i Sverige ca 8 procent , mot ca 5 procent i Österrike .
1617;2000-01-01;Flashback: Politik;Det är fortfarande mängden kronor per invånare som avgör hur mycket som kan satsas på de åtaganden som kommunen har .
1618;2000-01-01;Flashback: Politik;Speciellt om vi är ännu fler .
1619;2000-01-01;Flashback: Politik;Det är helt i linje med hennes stil i intervjusituationer .
1620;2000-01-01;Flashback: Politik;Det ger större frihet och möjligheter till egna beslut , när man får behålla mer av det man själv jobbar ihop .
1621;2000-01-01;Flashback: Politik;Fy fan vad jag är trött på idiotiska stollar , så jävla trött på rättshaverister och nazistgrisar .
1622;2000-01-01;Flashback: Politik;Alla tjänar , förutom möjligtvis de som blir utkonkurrerade , men de har faktiskt inte rätt till just det jobbet och får väl hitta något annat att göra .
1623;2000-01-01;Flashback: Politik;Han attackerar någon nazist för det som vänstern symboliserar .
1624;2000-01-01;Flashback: Politik;Några har åkt dit på det dessutom .
1625;2000-01-01;Flashback: Politik;Jag anser att mycket av det du försöker få att låta som universella självklarheter egentligen inte har någon som helst relevans i diskussionen .
1626;2000-01-01;Flashback: Politik;Anitra Steen kan behöva förstärkning i kassan .
1627;2000-01-01;Flashback: Politik;Intressant är att Finland inför något liknande som kallas välfärdsområden där vården tidigare har varit ett kommunalt ansvar , så centralisering av vården är tydligen en trend i tiden .
1628;2000-01-01;Flashback: Politik;Bruttonationalinkomst alltså .
1629;2000-01-01;Flashback: Politik;Om symboler ska vara förbjudna så ska naturligtvis även kommunistiska symboler vara förbjudna .
1630;2000-01-01;Flashback: Politik;Ja , det är verkligen obegripligt , och vilken ofattbar slump att killen dessutom råkar vara socialdemokratiskt kommunalråd .
1631;2000-01-01;Flashback: Politik;Att bara satsa på motorväg är rätt ensidigt bättre .
1632;2000-01-01;Flashback: Politik;Uppenbarligen så måste hon stå till svar från den shitstorm som media kommer köra , ( tänk Trump ) .
1633;2000-01-01;Flashback: Politik;Men jag är så nära kommunist man kan vara utan att vara det .
1634;2000-01-01;Flashback: Politik;Att köpa papper är att beställa MER träd .
1635;2000-01-01;Flashback: Politik;Förmögenhetsskatten har halverats från-1 , 5 % till 0 , 75 % , ogifta pensionärer med garantipension får-110 kr mer i månaden , och fastighetsvärdet fryses på 2006 års nivå .
1636;2000-01-01;Flashback: Politik;Det är dags att ta FN:s deklaration om de mänskliga rättigheterna på allvar och det görs till svensk lag .
1637;2000-01-01;Flashback: Politik;Dock så tror jag knappast att de gör det på grund av att de röstar fram ett parti i kommunalfullmäktige utan istället genom deras egna drivkraft för att få det bättre .
1638;2000-01-01;Flashback: Politik;den värdefulla skogen växer i norrland .
1639;2000-01-01;Flashback: Politik;På ett ganska elegant sätt , om jag får säga det själv .
1640;2000-01-01;Flashback: Politik;På ett sätt är det litet synd att TF saknar kvalitetsparagraf .
1641;2000-01-01;Flashback: Politik;Det avgörande är inte vilka som styr i kommunen , de representerar endast de som bor i kommunen .
1642;2000-01-01;Flashback: Politik;Alla ni som klagar på att folk är dumma och att allt skulle bli för jobbigt och att alla röstar fel borde kolla på Schweiz .
1643;2000-01-01;Flashback: Politik;Både rått och ruttet .
1644;2000-01-01;Flashback: Politik;En skattesubvention av hushållsnära tjänster leder inte till ökad sysselsättning .
1645;2000-01-01;Flashback: Politik;Vi har ett brett sortiment av hög kvalitet som är tillgängligt i hela landet .
1646;2000-01-01;Flashback: Politik;Tillåt uranbrytning för all del men se då samtidigt till att vi inte blir plundrade av riskkapitalister som fullständigt skiter i Sverige .
1647;2000-01-01;Flashback: Politik;De värnar om de rika , deras ställningstagande i denna fråga bekräftar detta .
1648;2000-01-01;Flashback: Politik;Och i Expressen inför valet-1998 fanns det en artikel jag aldrig glömmer : Man intervjuade tre kvinnor med tre olika politiska utgångspunkter / sympatier .
1649;2000-01-01;Flashback: Politik;Om någon påpekar att denne är vegan / vegetarian så rycker jag bara på axlarna och fortsätter äta .
1650;2000-01-01;Flashback: Politik;Det är en väl dold diktatur som förs bakom lyckta dörrar .
1651;2000-01-01;Flashback: Politik;Tyvärr ligger E4:an 5,5 mil västerut .
1652;2000-01-01;Flashback: Politik;"Det innebar att tillfälliga "" gästarbetare "" fick uppehållstillstånd för arbetsuppgifter som antingen inte fanns kompetens för eller som tyskarna själva inte ville utföra ."
1653;2000-01-01;Flashback: Politik;Vi har sett fem jobbskatteavdrag genomföras utan att vi kommer ur lågkonjunkturen eller fler jobb skapas .
1654;2000-01-01;Flashback: Politik;Det har inget med mänskliga rättigheter eller moralisk essens att göra .
1655;2000-01-01;Flashback: Politik;De flesta veganer skulle utan artificiell hjälp dö ut inom en relativt kort tidsperiod .
1656;2000-01-01;Flashback: Politik;Problemet har varit att nationella rörelser i tillväxtfasen tagit in vad skit som helst för att de tycker att det är kul med nya medlemmar och att bli större .
1657;2000-01-01;Flashback: Politik;Jag är en fattig student så jag är fattig oavsett om de rödgröna eller alliansen styr .
1658;2000-01-01;Flashback: Politik;De leder en svag minoritetsregering som hotas av de populistiska och invandrarfientliga Sverigedemokraterna .
1659;2000-01-01;Flashback: Politik;Sverige är dock ingen republik , utan en monarki med en kung ( alt drottning ) som statschef .
1660;2000-01-01;Flashback: Politik;Det här är fantastiskt .
1661;2000-01-01;Flashback: Politik;Ja det här är verkligen en demokrati , helt jävla idiotiskt och påstå annat .
1662;2000-01-01;Flashback: Politik;De är samma globalister som övriga riksdagen .
1663;2000-01-01;Flashback: Politik;Tack , det var snällt .
1664;2000-01-01;Flashback: Politik;Snart kommer nog hårdare regler från Zelensky att vi måste följa hans lag .
1665;2000-01-01;Flashback: Politik;Helt klart skall kommunismen och dess symboler vara olagligt .
1666;2000-01-01;Flashback: Politik;Alliansen , till skillnad från vänstern , tänker långsiktigt .
1667;2000-01-01;Flashback: Övrigt;Inga större problem .
1668;2000-01-01;Flashback: Fordon & trafik;Perfekt för långresorna genom Europa .
1669;2000-01-01;Flashback: Kultur & media;Vill ju inte avslöja vad det är riktigt men det hör ju inte heller hit .
1670;2000-01-01;Flashback: Kultur & media;Så tolkar jag i alla fall grejen med de meningslösa sammtalen .
1671;2000-01-01;Flashback: Kultur & media;De bestrider ju sin egen ideologi hela tiden .
1672;2000-01-01;Flashback: Kultur & media;Och när det kommer till nogrannare rengöring använder jag dammsugaren .
1673;2000-01-01;Flashback: Kultur & media;Men de ligger bra till prismässigt , när det gäller mottagning norr om dalälven har inte de andra tre operatörerna mycket att sätta emot .
1674;2000-01-01;Flashback: Kultur & media;Vilken färg de än är i kommer folk fatta att det är systemkassar .
1675;2000-01-01;Flashback: Kultur & media;Appen söker upp numret i en databas och presenterar resultatet för dig , allt går på någon sekund så du hinner bestämma dig innan du svarar .
1676;2000-01-01;Flashback: Kultur & media;Ibland behövs inte mer än så .
1677;2000-01-01;Flashback: Kultur & media;Men tror det mesta av deras produkter suger .
1678;2000-01-01;Flashback: Kultur & media;Denna typen av människor skaffar inte barn så tidigt .
1679;2000-01-01;Flashback: Kultur & media;Jag har skapat en lokal nät-community där ungdommar i min landsdel kan bli medlemmar och precis som på alla andra communitys skriva inlägg , lägga upp bilder och mycket annat .
1680;2000-01-01;Flashback: Kultur & media;Nu vet jag att Flashback har relativt få kvinnliga forumsskribenter men det vore uppskattat om både kvinnor och män gav sitt utlåtande om bilden och huruvida ni uppfattar den som anmärkningsvärt sexuell eller inte .
1681;2000-01-01;Flashback: Kultur & media;Ingen kock i sina sinnes fulla bruk skulle lägga pengar på det här .
1682;2000-01-01;Flashback: Kultur & media;Somliga andra burkar lackas invändigt med någon slags lack som härdas i tex en ugn .
1683;2000-01-01;Flashback: Kultur & media;För dyrt för att producera .
1684;2000-01-01;Flashback: Kultur & media;Idén är bra tycker vi och umgänget vi diskuterat med .
1685;2000-01-01;Flashback: Kultur & media;En bra idé är att besöka skolor och dela ut flyers osv .
1686;2000-01-01;Flashback: Kultur & media;Jag fullständigt avskyr allt vad Folksam sysslar med i reklam väg .
1687;2000-01-01;Flashback: Kultur & media;Jag gick till vanliga Apoteket istället .
1688;2000-01-01;Flashback: Kultur & media;Tack för era svar .
1689;2000-01-01;SweFN;Men någonstans har de tappat fästet , någonstans glömde de människovärdet , någonstans slutade de att känna empati .
1690;2000-01-01;SweFN;En dator kan inte känna empati och aldrig förstå .
