id;date;author;post
1;2021-01-01;NEWS;Den nya virusvarianten i Storbritannien har lett till stängda gränser i omvärlden. Larmet om den nya brittiska varianten av coronavirus har lett till panik och stängda gränser. 
2;2021-01-01;NEWS;Några personer syns framför fyrverkeripjäser. Människor betraktar privatfyrverkerier på Senatstorget snyggt!
3;2021-01-01;NEWS;Under nyårsnatten bröt polisen upp en svartklubb där man uppskattar att runt personer hade samlats mycket dåligt!
4;2021-01-01;PRDCL;Denna information kommer från boken Vad Läkemedelsbolagen inte vill att du ska veta om vaccin skriven av Dr. Todd M Elsner Nya_vaccin innehåll
5;2021-01-02;BLOG;Folkhälsomyndigheten försöker 'skylla' dödstal på trångboddhet - en NY dimridå och villospår som journalister sväljer med 'hull och hår'
6;2021-01-02;NEWS; Det nya normala , sades procent fler gånger i samtal mellan chefer och investerare under jämfört med 2019. New_York_Times har tillsammans med analysföretaget Sentieo kartlagt företagsfraser som blev det nya normala i USA det gångna året. Undersökningen har tittat på fler än 20.000 olika presentationer och analyserat hur företagsspråket förändrades i USA under pandemiåret 2020. De fann ett par återkommande formuleringar som användes i möten mellan chefer och investerare för att beskriva den nya tillvaron. Unprecedented times , vilket skulle kunna översättas till Tider utan motstycke , ökade mest i användning. Det nämndes i 2.128 samtal det gångna året, en ökning med över 70.000 procent jämfört med då det bara yttrades tre gånger. Hade du frågat mig vad som verkligen boomat på engelska så är det just 'unprecedented times'. Jag får mycket mejl från USA och i dem nämns det nästan alltid. Samma sak med 'take care of yourself' eller 'stay safe' , säger Stefan Öberg, vd på Tradera. Även arbeta hemifrån ökade signifikant, med 26.820 procent. Den frasen kunde höras i lite under 5.000 samtal medan utmanande landade på 14.655. Den senare ökade däremot endast med procent jämfört med ifjol. Även tekniska svårigheter fick ett stort uppsving. En fras som nästan blivit synonym med pandemin, när hemarbetandet ökat markant, är: du är på mute . Den användes 1.000 procent oftare i amerikanska affärsmöten det gångna året. Även i Sverige har det redan blivit en klassiker på digitala möten. 'Jag tror att du är på mute', den har verkligen boomat. Eller 'ser ni min presentation?'. Den frågar man varje gång man ska visa något. Det är nästan så_att folk inte_ens orkar svara längre. Sedan hör man ofta 'jag har problem med min kamera' , säger Stefan Öberg. Även hör ni mig? och vem var det? var två ständigt återkommande fraser på Traderas digitala möten i år. För Patrick Svensk, styrelseordförande för Readly, är det andra begrepp som tagit_sig_in sig i vokabulären. Det är klart att 'Zoommöten' har blivit ett eget begrepp som Tetra Pak. Ett bedrövligt år på det sättet, att vi pratar om 'Zoommöten' och inte vanliga möten. Redan i april hade jag använt nio olika mötestjänster. Så frasen 'hur fan delar jag den här presentationen i den här appen?' har också varit ofta använd , säger han. Enligt New_York_Times-undersökningen har användningen av svordomar varit oförändrad i år.
7;2021-01-02;NEWS;Mohammad Adil är från Pakistan och har arbetat i över år som läkare i Storbritannien. Han stängdes_av från sitt arbete efter_att ha kritiserat de coronarelaterade åtgärder som han menar skördar fler liv än pandemin i sig. Nu reser han runt Europa och anordnar demonstrationer mot nedstängningar . Videon är på engelska med svensk textning. Mohammad Adil är ordförande för World Doctors Alliance. Enligt beskrivningen på organisationens hemsida samlar man läkare, sjuksköterskor och annan hälsovårdspersonal med syfte att få stopp på alla nedstängningar och andra skadliga åtgärder för att i_stället återgå till en sjukvård som är bra för människor hälsa och välbefinnande. I denna intervju med Nya_Tider berättar Adil hur han under våren uppmärksammade en rad märkliga åtgärder i vården som enligt honom gjorde mer skada än nytta. Bland_annat ställdes alla planerade operationer och undersökningar in, vilket gjort att miljoner_människor med cancer inte fått den behandling de behöver och har rätt till. Fler människor i Storbritannien dör idag av olika typer av cancer än av Covid-19. Adils överordnade gillade dock inte det han sade, och när han gick ut med kritiken offentligt stängdes han av från sitt arbete under tolv månader i väntan på en utredning. Själv är han mycket kritisk till att han drabbats av dessa sanktioner, trots_att han uttryckt sin kritik på fritiden och i egenskap av privatperson. Avstängningen har dock gett honom möjlighet att i_stället arbeta med World Doctors Alliance och att anordna demonstrationer mot nedstängningar.
8;2021-01-02;PBLMD;Trots att data från helger är bristfällig och svår att bedöma tror statsepidemiolog Anders_Tegnell att det kan bli ytterligare en smittovåg av covidfall när helgdagar är över. - Vi kan se att det tyvärr är ett antal länder i Europa som hade nedgång men som är på_väg upp igen så det är väl en tendens att vi åter kommer att få en ny våg i europa efter helger Enligt senaste datan ser det ut som att coronafallen globalt sett blir färre, men på_grund_av helgdagar under jul och nyår är statistiken svår att bedöma. - Inom Europa ser vi en liknande trend som vi har sett tidigare, efter en stor topp i september gick det nedåt ett tag och nu är det tyvärr på_väg uppåt igenom, även_om den sista datan är svår att bedöma, säger Anders_Tegnell på lördagens pressträff. Tendens till ny våg De flesta länder i Europa hade en topp som var betydligt tidigare än i Sverige, runt vecka 45. Den svenska kurvan har gick upp lite senare, omkring vecka 50. Enligt Tegnell ligger Sverige nu på en nivå som kan jämföras med medelvärdet i Europa, och av allt att döma ökar fallen i de europeiska länder . - Vi kan se att det tyvärr är ett antal länder i Europa som hade nedgång men som är på_väg upp igen så det är väl en tendens att vi åter kommer att få en ny våg i Europa efter helger här, om inte de olika insatser som vi gör får väldigt mycket större effekt än vad de har haft hittills, säger Anders_Tegnell. Räknar med höga dödstal Dödsfallen är som_vanligt svåra att jämföra länder emellan och nu syns en omfattande fördröjning i statistiken över antal avlidna. Den senaste datan för Sverige kom i onsdags, då nya dödsfall rapporterades och de totala dödsfallen med bekräftad covid_19 landade på 727. - Med_tanke_på hur smittspridningen ser ut får vi nog tyvärr räkna med att det kommer vara ett högt antal dödsfall den här och nästa vecka, säger Anders_Tegnell.
9;2021-01-03;BLOG;Hej alla! Hoppas ni mår bra, det gör jag. Jag sitter i soffan mätt och belåten och löser lite korsord framför en brasa. Hur mysigt låter inte det? Jag känner_mig just nu mer hoppfull än vad jag känt_mig på jag vet inte hur länge. Corona-vaccin är här i Sverige och man har redan börjat vaccinera folk. Om jag förstår det rätt är det de äldre som kommer att prioriteras först att få vaccinet. Det kommer således ta ett tag innan jag får möjligheten att ta det, men det gör inget för mig. Det viktiga är att vaccin börjar rulla_ut så vi så_snart_som möjligt kan återgå till det vanliga. Är vaccin farligt? Det finns en hel del människor som säger att de inte kommer ta vaccinet. Såklart är detta upp till var_och_en att avgöra. Jag vet inte om alla människor är seriösa med sina uttalanden, men det finns de personer som tror att vaccin innehåller ett chip så_att högre makter ska kunna hålla koll på de som tar vaccinet. Det tror alltså helt seriöst att hela corona-virus var planterat med mening. Jag tror verkligen inte att detta är fallet. Med det sagt har jag ingen_aning om det kommer finnas några bieffekter av att man tar vaccinet. Många minns nog svininfluensan och vaccin som gjorde att visa personer fick narkolepsi. Jag tror att många är rädda att något liknande kommer hände med detta vaccin. Kommer jag ta vaccinet? Jag vet ännu inte riktigt om jag kommer ta vaccinet. På ett sätt tycker jag det är skönt att jag inte kommer kunna ta vaccin nu direkt. Då kan man ju se om vaccin fungerar för de som tar det. Om vi märker att vaccin inte har några bieffekter kommer jag garanterat ta det. Även_om jag är ung och inte har så stor sannolikhet att dö av virus finns det alltid en risk, så det är bättre att vara på den säkra sidan. Tjillevippen, vi hörs!
10;2021-01-03;NEWS;Region Stockholm har identifierat fyra fall av muterat covid-19-virus, uppger regionen i ett pressmeddelande. Enligt regionens smittskyddsläkare var detta inte oväntat. Det handlar om tre fall av den virusvariant som upptäckts i Storbritannien och ett fall av den variant, som kallas 501.V2, som identifierats i Sydafrika. Samtliga rör personer som vistats i dessa länder, uppger regionen. Regionens smittskyddsläkare Maria Rotzén Östlund säger i pressmeddelandet att det inte var oväntat att dessa nya mutationer skulle påvisas även i Stockholm. - Smittspårning genomfördes enligt våra rutiner så snart personer fick positiv_resultat för covid_19 och de har fått uppmaningen att följa de rekommendationer som gäller och isolera sig. Ett antal fall av virusvarianten från Storbritannien har redan tidigare konstaterats i flera regioner i Sverige, bland_annat i Sörmland. Den nya varianten har tidigare uppgetts ha en högre smittsamhet, men det är ännu inte klarlagt huruvida det stämmer. Ingenting tyder på att den skulle ge ett allvarligare sjukdomsförlopp. Regioner kliniska mikrobiologiska laboratorier har, med_anledning_av rapporter om mutationer, utökat sina analyser i samarbete med Folkhälsomyndigheten. Dessa har särskilt riktats mot prover från personer som testats positivt efter vistelse i Storbritannien, både nyligen och bakåt i tiden. Även resenärer från Sydafrika inkluderas sedan en tid tillbaka. Folkhälsomyndigheten uppmanar alla inresande som har vistats i Storbritannien eller Sydafrika att stanna hemma i minst sju dagar, undvika kontakt med andra så långt det går och att testa_sig snarast efter ankomst med uppföljande test fem dagar efter ankomst.
11;2021-01-04;MDCL;"Coronapanemin har pågått i nio månader och det har presenteras ömsom tröstlösa, ömsom optimistiska scenarier, ofta från samma källa, nämligen Folkhälsomyndigheten. För ett antal år sedan uppmärksammade en svensk_studie D-vitaminets betydelse för folkhälsan i ett bredare perspektiv [1]. På kris- och traumacentrum upptäckte vi då mycket låga värden hos invandrarkvinnor jämfört med hos kvinnlig personal (P<0,000) [2]. Sedan såg vi även D-vitaminbrist hos män inom samma grupper. Tillförsel av rekommenderade doser hade försumbar effekt på individer med svår etablerad brist. Dessa fynd var på inget sätt förvånande för den som studerat forskningslitteraturen noga [1], men de var samtidigt inte allmänt kända. Coronapandemin hade inte pågått länge innan det stod klart att översjuklighet respektive överdödlighet var vanligt hos mörkhyade personer i England och Skandinavien. Redan i maj skrevs det mycket i ämnet i The Guardian [3]; i_första_hand om sjukvårdspersonal inom den så_kallade BAME-gruppen (Blacks, Asians and minority ethnics). De förklaringar som oftast fördes_fram var utsatthet hos vårdpersonal, trångboddhet etc. Nyligen skrev en engelsk debattör att man inte hade haft någon Â»verkligÂ« nedstängning i England, då endast medelklassen har kunnat arbetat hemma medan många utsatta grupper tvingats gå till jobbet som vanligt. I Danmark och Sverige beskylldes invandrare för att sprida smittan, tills man insåg att det fanns andra förklaringar såsom trångboddhet och beroende av allmänna kommunikationer. En stor överdödlighet hos utsatta grupper har rapporterats i Stockholm [4]. vitamin-D spelar en viktig roll i olika immunologiska reaktioner, bland_annat relaterat till ACE 2-receptorfunktionen. I maj publicerade Läkartidningen en artikel där författar redovisar preliminära fynd av hög överdödlighet hos personer låga ingångsvärden av vitamin-D som sjukhusvårdats för covid_19 [5]. Nya sammanställningar pekar åt samma håll [6]. Enligt uppgift pågår ett 30-tal kontrollerade studier med fokus på effekter av vitamin-D [7], där resultaten väntas tidigast nästa sommar. Lancet Metabolism and Diabetes publicerade redan tidigt en kommentar som stödjer tillförsel av vitamin-D till grupper som riskerar ett allvarligt förlopp av covid_19 [8]. I England har regeringen i_enlighet_med det rekommenderat och finansierat D-vitamintillskott till utsatta grupper [9]. Då det hittills under pandemin varit svårt att etablera smittspårning (och även funnits andra logistikproblem) kan man befara att det dröjer innan vaccin på ett avgörande sätt får effekt på smittspridningen. Ansvariga myndigheter bör kunna införa rekommendationer om D-vitamintillskott utifrån följande kända kunskapsläge: vitamin-D kan med viss sannolikhet skydda mot svårt sjukdomsförlopp vid covid_19 [6] vitamin-D är ofarligt i doser om <10_000 IE/dygn, men en rimlig rekommenderad dygnsdos är 1_000-2_000 IE [10] D-vitaminbrist bör beaktas hos personer med mörk hudfärg, överviktiga, äldre samt övriga kända riskgrupper. Det är inte försvarbart att invänta resultat av pågående studier som kan komma att visa att ett stort antal dödsfall och långvarigt vårdkrävande sjukdomsförlopp hade kunnat undvikas genom rekommendationer om D-vitamintillskott."
12;2021-01-04;NEWS;47 procent av läkar som är medlemmar i Sveriges läkarförbund känner mer stress kopplat till jobbet sedan pandemin bröt ut, enligt en undersökning från förbundet. Arkivbild. Hälften av läkar har inte fått tillräckligt med vila sedan pandemin bröt_ut - vilket påverkar både arbetet och privatlivet, enligt en ny undersökning. Samtidigt är många oroade över den stora vårdskulden fjolåret lämnat efter sig. Extra långa arbetsveckor. Aktiverat krislägesavtal. Inställda semestrar. En växande vårdskuld. Krislägesavtal som aktiverats på nytt. Det gångna året har varit extra påfrestande på hälso- och sjukvården på flera fronter. Och enligt en undersökning från fackförbundet Sveriges läkarförbund uppger drygt hälften av deras medlemmar att de inte har fått tillräckligt med återhämtning under pandemin.
13;2021-01-04;NEWS;Den januari kommer riksdagen att rösta om den nya pandemilagen, som ger myndigheter utökade befogenheter. En som är starkt kritisk är läkaren Björn Hammarskjöld, som menar att den nya pandemilagen inskränker människor frihet på ett sätt som bryter mot grundlagen. Han är assisterande professor i pediatrik med lång erfarenhet av biokemi, och i denna intervju framför han kritik mot PCR-test, tvångsvaccineringar och regeringens övriga åtgärder. Assisterande professor Björn Hammarskjöld, numera pensionär, träder_fram och varnar för att pandemilagen som regeringen vill driva_igenom kan komma att strida mot svensk grundlag och EU- lag. Hammarskjöld förklarar att WHO har ändrat begreppet pandemi till en mer vag formulering och att även det som tidigare var väletablerad kunskap för att definiera vad en infektion är, nu med Covid_19 verkar ha frångåtts för att endast gälla de som har ett positiv_testresultat från ett PCR-test. De dödstal som media presenterat för oss avseende året som har gått menar Hammarskjöld är mindre än genomsnittet för 2015-2019 och han vänder sig emot jämförelsen med Spanska_sjukan som han menar inte är medicinskt jämförbar med årets coronainfluensa. Hammarskjöld har, utöver sin läkarexamen och assisterande professur i pediatrik, även en filosofie licentiat i biokemi och har arbetat på laboratorium i USA med att forska kring HIV-viruset. Hammarskjöld är mycket kritisk till att resultat från PCR-test används för att ersätta en tidigare etablerad definition av infektion vad_gäller Covid-19, och förklarar varför PCR-test inte är tillförlitliga när det kommer till att avgöra virala sjukdomstillstånd. Hammarskjöld hävdar vidare att den beräkningsmodell som hela världen har använt_sig av för att uppskatta kommande dödsfallen i pandemin visat_sig vara mycket felaktig, och att personen som legat bakom beräkningsmodellen även tidigare har fört_fram felaktiga beräkningar i medicinska sammanhang. Hammarskjöld berättar om forskningsfusk och hur grunden för WHO:s rekommendationer kring provtagning av Covid-19, som har påverkat en hel värld, troligtvis inte har genomgått en expertgranskning utan publicerats på rekordtid dagen efter_att rekommendationer inkom. I intervjun framgår också att man inom forskningsstudier ofta inte redovisar vad placebo består av, då läkemedelsindustrin utvecklar en produkt, något som kan få som konsekvens att man inte kan urskilja hur många som reellt har skadats av produkten. Ofta låter man nämligen placebo innehålla många av ingredienser i den skarpa läkemedlet eller vaccinet, vilket förstås påverkar resultatet. Hammarskjöld har frågor om det vaccin som nu erbjuds svenskar , frågor som han anser att läkemedelsutvecklar först borde svara på innan deras produkt godkänns. Han vänder sig starkt emot att det kan bli tvång att uppvisa vaccination för att åtnjuta grundlagsskyddad rörelsefrihet och kallar det hela för utpressning. Han ifrågasätter den amerikanska och svenska_staten beslut att ge dessa läkemedelsbolag åtalsimmunitet för eventuella skador som uppstår till_följd_av deras produkter och lyfter_fram detta som ännu ett argument för varför det svensk_folk inte bör ta vaccin mot Covid-19. Riksdagen röstar om pandemilagen den januari 2021.
14;2021-01-04;NEWS;Det är nu procent fler patienter på brittiska sjukhus än vad det var för en vecka sedan, säger Storbritanniens premiärminister Boris_Johnson under ett tv-sänt tal där han tillkännager en nationell nedstängning av England. Dödstalen i landet är upp med procent den senaste veckan. Foto: Stefan Rousseau/AP/TT Från_och_med midnatt kommer det engelska samhället att stängas_ned med lika omfattande åtgärder som man hade i mars förra året. Nya nedstängningar väntar för England, meddelar premiärminister Boris_Johnson i ett tv-sänt tal på måndagskvällen. Det är samma besked som Skottland gav tidigare under dagen. De ny regler börjar gälla omedelbart, och blir lag under natten till tisdag. Den gäller fram till mitten av februari.
15;2021-01-04;NEWS;En ny, brittisk undersökning visar att coronavaccinets kapacitet påverkas negativt av alkoholkonsumption, och därför bör undvikas. Men det låter osannolikt menar svenska experter - som har en annan teori. Immunförsvaret kan reagera sämre på vaccin mot covid_19 om du har alkohol i blodet, det menar brittiska Sheena Cruickshank, professor i immunologi. Anledningen påstås vara att alkoholen förhindrar uppkomsten av viktiga mikroorganismer i tarmen, som i_sin_tur hjälper immunförsvaret att bekämpa virus. Samma sak visar en undersökning genomförd av Dr Ronx Ikharia, expert inom akutmedicin. Hennes studieresultat visade att tre glas prosecco kan reducera patienters mängd vita, virusbekämpande, blodkroppar till hälften, enligt Metro. Resultaten lade grunden till en brittisk rekommendation under söndagen - den som vaccinerat_sig mot covid_19 bör undvika alkohol. FINNS INGA KLINISKa_STUDIER Men flera svenska experter som Nyheter24 varit i kontakt med ställer_sig tveksamma till undersökningens påstådda resultat. Enligt Charlotta Bergquist, vaccinkoordinator på Läkemedelsverket, finns det inget som tyder på att just coronavaccin skulle vara mer känsligt mot alkohol än något annat. - Det är ju väldigt generella uttalanden skulle jag säga. Det finns inga kliniska_studier där man vaccinerar och ber folk dricka alkohol samtidigt, jag har svårt att se det etiskt försvarbara i det, säger hon till Nyheter24. Om en alkoholkoppling finns tror hon därmed inte att den är specifik för vaccin mot covid-19. - Det gäller ju inte bara det här vaccinet, det gäller ju vilket vaccin som helst, i sådant fall, säger hon till Nyheter24. MAN VILL ATT FOLK SKA SKÖTA SIG Matti Sällberg är professor i biomedicin, och även han intygar att en sådan slags koppling är osannolik. Enligt honom spreds liknande information i Ryssland inför landets påbörjade vaccinering, men det tror han hade mer disciplinära avsikter: - Det beror ju mer på att man inte vill att folka börjar skåla i champagne så fort man är vaccinerad. Man vill att folk ska sköta sig, säger han till Nyheter24. EXPERTERNA ÄR ENIGA Sällberg har inte själv tagit del av några studier som påvisat att coronavaccinets kapacitet påverkas negativt av alkohol. Även där är han enig med Läkemedelsverket. Enligt Bergquist känner inte Läkemedelsverket till den påstådda kopplingen: - Nej, inte alls. Och det är inga data vi förväntar_oss heller, säger hon till Nyheter24.
16;2021-01-04;NEWS;I Grand County i Colorado registrerades fem döda i Covid-19, men av dessa visade_sig två ha dött i en skottlossning, där den ene sköt den andra och sedan sig själv. Rättsläkare Brenda Bock berättade för nyhetsbolaget CBS: - Dessa två personer hade testat positivt för Covid, men det är inte vad som dödade dem. Skottskador dödade dem och det är väldigt vilseledande att uppge att dessa personer dog av Covid när det inte är vad de dog av. Bock höll fortfarande på med den rättsmedicinska undersökningen när delstaten räknade dem som coronadödsfall: - Jag förstår att man försöker hålla räkningen, men man måste göra det på rätt sätt.
17;2021-01-04;NEWS;Nästan alla regioner i landet är drabbade. Arkivbild. Nästan alla svenska regioner, av 21, har brist på biomedicinska analytiker, som analyserar covid-19-tester. - Det har påverkat testkapaciteten negativt. Det är en av flera orsaker till att vi har haft svårt att komma upp i de önskade nivåer vid olika tillfällen, säger Claes Ruth, som är testsamordnare och funktionschef vid Karolinska universitetslaboratoriet i Solna, till Sveriges_Radio Ekot.
18;2021-01-04;NEWS;Vaccinsamordnare Richard_Bergström. Arkivbild. Modernas_vaccin mot covid_19 väntades godkännas i EU under måndagskvällen, men Europeiska läkemedelsmyndigheten (EMA) meddelar att den kommer inte att fatta ett beslut under kvällen, skriver EMA på Twitter. EMA:s kommitté för mediciner för människors (CHMP) diskussion om Modernas covid-19-vaccin har inte avslutats i dag. De ska fortsätta på onsdag den januari 2021. Inga ytterligare kommentarer kommer att ges i_dag , skriver EMA.
19;2021-01-04;PBLMD;Flera regioner diskuterar nu prioriteringsordningen för vaccineringen mot covid-19. Allt fler vill att vårdpersonal ska prioriteras högre. Region_Östergötland tycker det är bra att frågan nu lyfts. - Vi måste föra den här dialogen med Folkhälsomyndigheten, säger Rickard Lundin. Både region_Skåne och Region Västra Götaland har lyft frågan om att vårdpersonal borde prioriteras högre, nu när vaccineringen är i gång. Region_Östergötland bekräftar att man för diskussioner i frågan. - I_och_med_att frågan tas_upp både nationellt och internt inom våra verksamheter diskuterar även vi det med Folkhälsomyndigheten. Det är svårt att ändra, utan att ha haft den här dialogen med dem, säger Rickard Lundin, regional sjukvårdsledning, till SVT Nyheter Öst. Har lyfts internt Frågan har lyfts internt inom flera verksamheter, enligt Rickard Lundin - bland_annat hos IVA-personal. - Jag tror att man måste titta på helheten kring tillgången av vaccin för att göra bedömningen vad som är bäst på totalen. Den informationen har inte vi, utan den sitter Folkhälsomyndigheten på. Men jag förstår de verksamheter som nu lyfter frågan. Det är de som står på frontlinjen mot viruset, säger han. Första gruppen klar nästa vecka Under måndagen mottog Regionen ytterligare doser vaccin, som ska doseras på särskilda boenden. Om vaccinleveransen fortsatt hålls räknar Regionen med att gruppen särskilda boenden ska vara klar nästa vecka. Med nuvarande prioriteringsordning står sedan individer med hemtjänst eller insatser i hemmet näst på tur. - Vi borde relativt snart få en signal från Folkhälsomyndigheten över hur vi bör tänka framöver. Vi är mitt uppe i fas nu och om vi ska göra omstruktureringar bör det göras nu i så fall, säger Rickard Lundin. - Vi får se hur virus beter sig. Det här virus är ju lite lömskt, säger Matti Sällberg och menar att det är oklart hur många gånger man behöver vaccineras. Foto: SVT
