id	mydate	author	posts	text
1526	2024-04-12	johnjozefsson	223	Ja allt är alltid svenskarnas fel. Den vita mannen är ond. Det ska bli skönt med ett totalt folkutbyte inom några år.
1527	2024-04-12	DeValera	16929	På vilket sätt är svenskar empatistörda? Vi ger mest i bistånd till andra länder per capita. Vi tar emot flest migranter bland OECD per capita. Vi låter dessa migranter ha det bättre ekonomiskt genom bidrag än vad många av den inhemska befolkningen har. Vi använder oss inte av tortyr, stympningar, avrättningar, steningar som bestraffningsmetoder. Visst finns det svenskar som stjäl, ljuger, bedrar, men inte i lika hög utsträckning som fler andra folk gör. Så exakt vad gör svenskarna empatistörda?
1528	2024-04-12	Fiffiniffi	9866	Är inte det vad övriga befolkningen gör också? Hur många empatistörda svenska tror du tränger sig på i deras sorg?
1529	2024-04-12	Leanderine	466	Svenskarna ojade sig över offren för hedersmord, balkongkastningar, barnäktenskap, kvinnlig omskärelse, gruppvåldtäkter, pissrån och gängmord. Vi hade fackeltåg och skit, vi betalade och betalar MÄNGDER i skatt till olika välvilliga integrationsåtgärder och preventiva insatser för unga invandrare. Allt detta resulterade enbart i ännu mer ohämmat invandrarvåld samt orsakade snabbt växande korruption i offentlig sektor sedan tillräckligt med invandrade kriminella integrerats in till maktens syltburkar. Misstänker att folk börjar tycka att det inte längre räcker att oja sig och göra handhjärtan och ha fackeltåg. De flesta av oss har dock fortfarande en väldigt lång bit kvar innan vi uppnår den grad av empatilöshet som möjliggör att man skjuter förbipasserande pappor i huvudet. Svenskar är ett civiliserat folk och hade självklart tyckt det vore minst lika hemskt om det vore svenskar som sprang omkring och sköt ihjäl folk på gator, torg och i gångtunnlar. Men nu är det ju inte svenskar som gör sånt.
1530	2024-04-12	SoberZealot	4150	Eller hur. Ni får komma till Sverige för att ni flyr krig. Och ni får allt serverat. Bostad. Läkarvård. Och vi betalade. Och vad händer sedan? Jo ni beter er som skit. Kaxiga, våldsamma. Och skriver hatiska inlägg som dessa. Du är bara en rasist som inte gillar vita. Mångkultur fungerar inte. Så, nu, vill jag bo med mina fränder. Jag vill inte bo med skitar som dig.
1531	2024-04-12	N0.N4M3	684	Människor, låt er inte tro att svenskarna är som den dysfunktionella trasiga hatiska minoriteten som sprider sitt hat och fascism mot vanliga medborgare här på fb. I verkligheten är svenskarna motsatsen till detta, vi är mycket empatiska, toleranta (men vi accepterar inte vadsomhelst!), emot riktig rasism, emot homofobi o.s.v. vi är emot förtryck och anser att folk ska kunna ha vilken religion man vill sålänge man är fredlig, även om vi är sekulära och inte är religösa, kan vi inte tvinga alla att leva som vi väljer att göra. Svensken är modern och ogillar att vara bakåtsträvande, vi vågar att sticka ut och stå upp för andra folkgrupper, folk som är annorlunda o.s.v. Hatarna och fascisterna (menar inte TS nu även om jag inte håller med) försöker göra om svensken till onda fascister som hatar folk baserat på etnicitet, läggning, kön och religion (istället för att döma folk efter deras handlingar som vi normala gör!) genom att spamma samma lögner om och om igen. Men intelligenta människor fattar att det är en obetydlig trasig minoritet som har en ond & dold agenda som sprider sådant på nätet hela tiden. Låt er inte luras av detta och påverka era åsikter om oss svenskar! Vi står för kärlek och rättvisa, inte hat och fördomar! Bara för att en ytterst liten extremistisk minoritet är sådana betyder det inte att alla svenskarna är så, majoriteten är motsatsen till detta. Vi kan inte särbehandla svenskar, eftersom det då blir rasism. Vi måste vara snälla mot varandra, både majoriteten svenskar och invandrare vill lösa problemen och kriminaliteten. Vi måste samarbeta, det är det enda som kommer funka i dagens demografiska läge.
1532	2024-04-12	snusjohan	763	Det är väl snarare rasfrämlingar från öknen som är empatistörda.
1533	2024-04-12	N0.N4M3	684	Inte alla, det finns många som är motsatsen till detta. Kan ni bara sluta och generalisera så grovt? Det leder inte till något konstruktivt överhuvudtaget, vare sig man kritiserar och generaliserar kring svenskar eller invandrare.
1534	2024-04-12	Kapitalistkalle	2045	Det är väl empati att reagera starkt. Tråkigt med så mycket svenskfientlighet på ett svenskt forum.
1535	2024-04-12	snusjohan	763	Det har ingen betydelse för i Sverige ska endast vita människor bo.
1536	2024-04-12	Statistenidittliv	19481	Dödsskjutningar är ju tyvärr numera vardag så folk börjar väl bli avtrubbade.
1537	2024-04-12	Cheddarjoe	5277	Största problemet som vi inte har är civilkurage inbyggt i benet. Ett exempel på ett land där invandrare blir integrerade snabbt är USA. I Usa lär man barn vikten av etik och uppförande är ett betyg i skolorna. Man slår ned på människors beteende som är dåligt direkt. I sverige är det ingen som säger ifrån när det sitter 5 ungdomar på ett tåg med fötterna på sätena. Här i USA så säger alla till direkt. Vi har mer "sköt dig själv" och det beror mycket på att folk inte vågar stå ut heller som en följd av att vi inte är ett stort land. Inför man uppförande och etiska skolprov så kommer förändrningen sakta men säkert ske från början till slut. Sedan måste man börja säga ifrån mer. När en 7 åring gör fel får man knappt skäll längre.
1538	2024-04-12	mangne	10014	Vi har haft en enorm ekonomisk utveckling i Sverige, många svenskar har svingat sig uppåt. Folk blir i allmänhet lite ding av det, de bryr sig mera om aktier, konsumtion med mera. Än att reagera på orättvisor i samhället bland marginaliserade. De vill bo bland andra framgångsrika, medelklassens förbannelse ,de bryr sig inte om något riktigt utan fokuserar på icke problem
1539	2024-04-12	prz11	834	Du har avsaknad av empati för svenskarna och kan istället inte se det från svenskarnas sida. Sverige har gått från ett av världens bäst fungerande länder till ett ghetto på många ställen, enda välfungerande platserna är som alla förstår där det nästan bara är svenskar. Likadant är det på exakt alla platser i världen där det är för mycket MENA. EXAKT samma sak sker.
1540	2024-04-12	HansVonFreudhaus	863	Men vänta, det är ju just precis empati-kärringaktigheten som har lett svenskar in i fördärvet. Vi ska ta hand om invandrare, vi skattebetalare ska ta hand om singelmorsors ungar och vi ska ta han om kriminellt pack och så vidare. Men om vi nu ska ta hand om de anhöriga till den mördade mannen, så håller de nog med om att vi behöver få ut invandrarpacket och starta massdeportering och skicka mördare in i elektriska stolen eller halshugga dem. Man behöver sätta in militären och slå ner våldsverkarna. Det är något vidrigt med folk som TS som kan vara en så självgod kräk att man sätter sig på höga moralhäster, som att man är för mer och "godare" än andra som faktiskt bryr sig om vad brottsoffren och dess anhöriga önskar. De önskar då fan inte några fritidsgårdar eller daltande. Idiot.
1541	2024-04-12	rotebro-conny	20035	Känner du också empati för dom förmodade unga killarna som gjorde detta, deras situation och hur snett det gått för dom?
1542	2024-04-12	rotebro-conny	20035	Fast det var ju mest spelad empati av ungefär samma slag som politikerna visar upp framför kamerorna.
1543	2024-04-12	Haniballe	436	Jag måste nog säga att det är precis tvärt om! Vi har för stor empati och har tagit emot allt för många empatistörda asylsökande! Svenskar lider inte brist på empati! Det är de som kommer hit med trauman som är empatistörda och har ställt till det som nu pågår i vårt avlånga land. Tragiskt!
1544	2024-04-12	Doraemon-FTW	3430	Inte lika mycket som för offret, men absolut får man anta att det inte var en uppväxt med fredagsmys och stuga på landsbygden. Det är sällan grabbar som haft en kärleksfull uppväxt blir kallblodiga mördare.
1545	2024-04-12	Onanikrem	11005	Visst, det kanske är en empatistörning men snubben är död, dödad av vad som torde vara osnutna babbeyngel. Killen blir inte mer levande för vi sörjer och lägger blommor, tänder ljus och sjunger kumbaja kumbaja. Han blir heller inte levande igen om vi låser in, skickar hem eller avrättar alla babbe-mördar-yngel. Men skulle vi göra dessa tre med alla som polisen kan få fatt i så skulle Sverige bli lite säkrare för varje dag att inget sådant här tragiskt händer igen! Hittills har det mest varit babbar som mördat babbar eller babbar som mördat tjejer som knullar med babbar. Nu gick det åt en vanlig småbarnspappa, avrättad mitt framför sin son.. Någonstans måste det få ett slut, avliva varenda en av de som ränner runt och tror de är gangsta!
1546	2024-04-12	Doraemon-FTW	3430	Där är vi eniga. Sverige är extremt på många sätt, inte minst synen på sig själv och andra. Man när en självbild där Sverige är fantastiskt på alla sätt och att det är helt självklart att hela världen står på kö för att komma hit och bli svenskar och fira midsommar och gå med i facket. Men samtidigt isolerar man sig från invandrare (förutom "dom som är okej"). Det hade varit mer ärligt om svenskar ställde sig vid Öresund och urinerade på afghanerna och syrierna som riskerat livet för att fly från krigshärdar, än att vara pseudo-välkomnande för att sen, empatistört, lämna invandrarna åt sitt öde i eftersatta ghetton.
1547	2024-04-12	Fizzlor	4743	Ingen är skyldig invandrarna någonting. De "flyr för sina liv" påstås det, då borde en tvåa i närmsta förort vara rena drömmen jämfört mot att dö i krig. Eller? Svenskarna som grupp har aldrig röstat om att ta in miljoner araber eller negrer. De enda svenskar som varit "pseudovälkomnande" är Stockholmseliten och extrem vänstern. Vi snackar 20% på sin absoluta höjd. Resten vill inte ha med smutset att göra alls, ens låtsas som man vill det.
1548	2024-04-12	FettoBob	378	Det är du som har empatistörning som inte kan sätta dig in i svenskarnas situation. Dom är uppenbarligen upprörda över dom tio tusentals våldsbenägna gängkriminella och ännu fler islamister som finns i Sverige. Stick här ifrån om du ska vara rasist mot svenskar.
1549	2024-04-12	Månsan	22673	Nej, enligt all tillgänglig forskning är svenskarna världens mest empatiska folk. Så till den grad att tillvaron blivit farlig för dem. Svensken i gemen är så självutplånande empatisk att han ofta blir lurad och utnyttjad. Att Sverige är segregerat beror istället att så många människor utan förutsättning att klara sig flyttat till Sverige. Mycket låg genomsnittlig IQ hos invandrarna är det enskilt viktigaste skälet att integrationen inte fungerar. Exempelvis somalier har en genomsnittlig IQ under 70, vilket är att jämföra med utvecklingsstörning i den civiliserade världen. Arabers IQ överstiger mycket sällan 90, strax över 80 ligger deras genomsnitt som grupp. 80 motsvarar en mycket korkad svensk som gått i särskola och som endast kan utföra mycket enkla arbeten. Så där fortsätter det med de flesta inavlade klanfolk, som svenskarna pga sin sjukligt stora empati, importerat för att vara snälla. Ett samhälle som till en fjärdedel består av närmast efterbliva invandrare saknar helt förutsättningar att fungera på något plan.
1550	2024-04-12	Sladdaren	10059	Orsak till segregation "utan att göra rätt för sig" som man brukar säga är bara pga fel sorts invandrare / kultur och islam. Inte svårare än så Svenskar har inget med saken å göra förutom att de betalat detta med sin lön så det räcker och blir över i 1000 år till. Så svenskar är väldigt behjälpliga och ställer upp väldigt dumsnällt till invasions främlingar
1551	2024-04-12	Leanderine	466	Väldigt väldigt många lärare, bibliotekarier, kommuntanter mfl ville verkligen vara GODA. Massa yngre förmågor med flowerpowerideal ville också vara just GODA. Alla eventuella problem skulle lösas mha positivt tänkande. De svenskar som dristade sig till att uttrycka tvivel blev i princip korsfästa. Värdegrunden trumfar lagen, som nån pigg myndighetschef uttryckte saken när det skulle rensas ut heretiker ur leden. Svenskar har varit något så ofattbart naiva. Vi trodde alla om gott. De små ensamkommande baaaarnen fick nallar och årskort på simhallen. Mot taharrush fick vi tafsa-inte-armband. Mördare ömkades i tv av självaste rikspolisfjollan. Nu har vi sedan snart 10 år haft det det mycket tveksamma nöjet få att stifta blott alltför nära bekantskap med horder av lättkränkta kusiner från MENA, och det verkar nästan som att de där positiva tankarna inte riktigt rådde på verkligheten. Det var säkert svenskarnas fel, vi tänkte helt enkelt inte tillräckligt positivt. Jag är iofs tacksam över att de flesta ur medelklassen bara låtsades älska babbar för att få behålla jobbet och kunna betala av på villa- och billånen. Dessa vindflöjlar utan någon som helst moral kommer inte att protestera när det blir opportunt att kräva dödsstraff och massdeporteringar. TS, mångkulturella samhällen är alltid och utan undantag instabila. Du kanske skulle ta dig en liten funderare på vilka som gynnas av den typen av instabilitet innan du börjar hacka på svenskar för "empatistörning".
1552	2024-04-12	Fullhora	750
1553	2024-04-12	zansibal	1136	Tycker hela trådstarten känns som gaslighting.
1554	2024-04-12	peterpanp	10230	Jag segregerar mig inte från invandrare. Bor i ett bättre villaområde ute på landet/kusten ca 1 mil från den stökiga storstaden. Här umgås jag med vänner och bekanta, inklusive en granne/polare vars fru är invandrare från USA. Ibland så fiskar jag även med min frus systers man som är från Frankrike. Upplever inte att svenskar är empatiskt störda. Däremot oerhört godtrogna, och för empatiska för de människor som de tycker synd om (brottslingar, förövare, märkliga kulturer som saknar empati, etc). "NATO kommer att starta krig mot Ryssland." "Inte så märkligt att några miljoner judar också dör. Men det betyder inte att de gasades ihjäl." -Dumdryg "Så alla som inte är beredd att gå ned på knä och suga av Elon Musk och sedan låta honom knulla en i arslet utan glidmedel är en Teslahatare" -hakro807 "Skulle AfS komma till makten och inte leverera. Då blir det NMR för mig." -Ganonito "Jag flyttar inte till Ryssland, för jag drömmer om att ryssen ockuperar Sverige!" -Hultabultan
1555	2024-04-12	Doraemon-FTW	3430	Poliser gör sitt jobb. Psykologer också. Vad är ditt jobb där du måste dra SD-kortet så fort en invandrare begår ett brott? Är du månne anställd av SD? Hela Sverige är drabbat av marknadsliberaliseringen och utförsäljningen av det offentliga.
1556	2024-04-12	lahavana	3425	Jag segregerar mig för att annars blir jag skjuten i ansiktet. Du anklagar dessa "empatistörda svenskar" för att skifta fokus från familjen, men det är ju exakt det du gör själv, du försöker enbart att smutskasta de som visar att de har fått nog av alla dessa skjutningar för att de går emot din vidriga ideologi. Du har inte en jävla tanke på offret eller hans familj, allt du är orolig över är hur detta ska påverka folks åsikter om massinvandringen. Ha lite jävla självinsikt för en gångs skull. Du är hatad av en anledning, du är ett smutsigt jävla kommunistiskt troll, empatistörning kommer fan inte i närheten av vad du lider av.
1557	2024-04-12	rotebro-conny	20035	Akademiker alltså, intressant reflektion. Fast det var ändå godhet som "inte kostade" något dom ägnade sig åt och att det gick så snett och långt handlar väl snarare om en övertro på sig själva, sin duktighet och inte så mycket om empati? Hade dom haft empati och känt så mycket för dom här människorna på riktigt hade dom väl flyttat in i deras områden i stället för att bo kvar bland fördomsfulla och "tråkiga" svenskar vars åsikter dom bekämade?
1558	2024-04-12	anv3n	2	Du missar en viktig poäng. Hade detta hänt i Sverige 1988 hade folk reagerar så som du efterfrågar. Nu reagerar folk som man gör därför att det som är det mest tragiska i händelsen inte är att en pappa dött och barn blivit föräldralösa, utan att ett land kollapsat.
1559	2024-04-12	Mad_monk	21567	Problemet är det motsatta vi har alldelses för mycket empati för empatilösa babbar. Jag tror inte TS har så mycket empati heller.
1560	2024-04-12	Greta.El.HAMAS	712	Orsaken till Sveriges situation idag beror i princip nästan uteslutande på invandringen. Och då enbart pga av invandring från degenererade kulturer i mellersta östern och från muslimska länder. Kulturen och avsaknaden av empati i dessa länder ligger på en nivå samma som i "Game of Thrones". Krocken med den importerade ondskan och svenska värden som knattelag och kyrkans barntimme säger allt!
1561	2024-04-12	eva89	980	Först och främst; det är rent självskadebeteende för mig som svensk kvinna att bo bland invandrare; alla kulturer är mer kvinnofientliga än vår. Att vi vill agera istället för att agera gråterskor med uppåtvända handflator handlar om att vi är lösningsorienterade. Detta att vi skulle vara fredsskadade är inte riktigt sant, nu är vi ockuperade och därav passiviserade. Sen franska revolutionen har vi tidvis levt med hot om inbördeskrig, nån gnista från revolution som i Ryssland, ett attentat från inbördeskrig som i Finland. Det har vi löst genom att vänstern sopat rent på sin sida och högern sopat rent på sin. Nu är vi ockuperade av folk som fullständigt skiter i att sopa, både framför egen dörr och den skit de har dragit in. Istället ser de sig som bättre, just för att de inte är exempelvis kriminella.
1562	2024-04-12	KlartSur	6875	Du behöver inte backa till 1988, utan det räcker med 2014. Innan Reinfeldts "Öppna era hjärtan" levde vi ett helt annat land. Det finns många skyldiga både före och efter Reinfeldt, men ändå sticker han ut, eftersom han till skillnad från många av de andra (som Löfven) är intelligent och inte en idiot. Reinfeldts ondska är därför värre än de andras. Magdalena hamnar snart i samma klass, medan idioten Ulf hamnar i de hjärndöda grupp.
1563	2024-04-12	lone_star	8182	Det ligger en hel del i detta att en ev empatistörning är orsakad av att det meningslösa våldet blivit så vanligt i Sverige. Helt rätt att folk reagerat helt annorlunda på 1980-talet än nu. , gällande mordet. Det är lite som hustrun som blir misshandlad. Första gången är det en enorm smärta och enorma känslor. Gång 242 så är det lite som en dask på baken. Det är en nedgående spiral som Sverige haft i många år nu som undan för undan trängt bort empati och normala känslor. Lika naturligt som många svenskar förlorat sin patriotism och stolthet för landet.
1564	2024-04-12	Leanderine	466	Många yngre akademiker försökte bo bland invandrare, särskilt i Malmö. De var fulla av välvilja och entusiasm. Här skulle det hjälpas till och umgås med de stackars "flyktingarna". Alla skulle vara välkomna in i gemenskapen, det skulle ätas exotisk mat ihop och svenskarna skulle lära sig så mycket om andra spännande kulturer. Man kan säga att det sistnämnda lyckades. Långt över förväntan Av dem jag känner har samtliga flyttat så långt bort från nyanlända som bara möjligt - fast absoluuuut inte pga att det inte går att bo bland folk som kastar ut soporna från balkongen, kedjeröker i trappen, hotar barn och kvinnor, stjäl allt som inte är fastskruvat, väsnas oupphörligt dygnet runt och gömmer skjutvapen i gemensamma utrymmen. Absolut inte därför.
1565	2024-04-12	Sssiamesia	591	Doraemon, det här är verkligt intressanta frågeställningar, och det är bara att beklaga att nivån på de flesta svar är lägre än låg. På sätt och vis kan man väl säga att åtminstone den del av svenskarna som representeras här bevisar dina teorier genom sina egna korkade ickereflektioner. Sverige har länge varit ett tryggt land, vilket har lett till att dess invånare är bortklemade och inte längre är så haj på att tänka själva, att förstå sig på saker, att ta gemensamt ansvar mm. Vi har också en utarmad skolundervisning sedan trettiotalet år, vilket fört med sig att den genomsnittlige svensken idag ofta saknar grundläggande kunskap i det egna språket. Detta leder till stora svårigheter att ta till sig text, med följande obildbarhet. Svaren i bland annat din tråd visar tydligt hur brister i språkförståelse gör att folk missar poängen och därmed hamnar utanför debatten. Samma fenomen ligger bakom exempelvis SD:s framgångar. Det ser inget vidare ut för Sverige, men det är inte några utländska människors fel, tvärtom! När ett samhälle består av en växande grupp halvanalfabeter, som är egotrippade, lata, bortskämda och aldrig mött några svårigheter i livet (utöver bekymren med penisprickar, stjärtklåda, dåliga droger och liknande som Flashbackarna har ångest över), så finns det ingen ryggrad kvar. Bara en massa inskränkta små kryp som är rädda för allt, tycker att det är jobbigt att tänka och helst bara vill stå och grilla i trädgården i foppatofflor hela tiden. Jag förstår att denna enfaldiga människa tycker att det är jobbigt med andra som vill "hjälpa". Med nästippslångt förstånd är det lätt att tro att om inte någon hade valt att öppna landet för invandring så skulle allt ha varit bra, och man hade kunnat grilla och titta på Melodifestivalen ostört, utan att behöva konfronteras med obekväma saker från världen utanför. I Sverige vill man helst inte konfronteras med sina grannars barnmisshandel, hustruvåld eller övrig utsatthet heller. Man stänger dörren och förfasar sig bakom gardinen istället för att gå och knacka på när barn, kvinnor och djur skriker i huset bredvid. Sverige är kortfattat ett land av ynkryggar, och ja, de är empatibegränsade, de är korkade och de tycker att ett rimligt standardsvar när något hemskt händer runt omkring dem- mord, barnavåld, sexbrott eller vad fan som helst - är: "jag förstår inte hur det kunde hända". Att denna enfaldiga varelse, som inte ens kan begripa varför saker händer, tycker att exempelvis den lille ärkefjanten Kristerssons idéer om hårdare tag, eller kanske de egna fantasierna om att gå ut och strida med ankelsocka och knölpåk, är inte konstigt. Dock är det landets undergång. På sätt och vis kunde det bli en underhållande syn att se de små blekfeta och självgoda svenskarna strida mot folk som är empatistörda på riktigt och som levt ett tusen gånger hårdare liv, sett och förstått allt som är obegripligt för den gängse svensken. Det finns säkert någon slätt, eller ett berg, någonstans där ni kan samlas, om ni klarar att gå på ojämna underlag och möta fiendens läskiga blickar utan att brista i gråt.
1566	2024-04-12	zombie-nation	11406	Jag tycker verkligen det är hemskt när man använder offer som politiska slagträn. Det spelar ingen roll vem som gör det. Hemskt när denna händelse får SD att bli starkare. SD älskar verkligen när det blir kaoz. Svenskar är väldigt dåliga på att socialisera med andra än svenskar. Eller med okända svenskar. Vi är faktiskt kända för att vara väldigt avståndstagande till nya människor, hört det särskilt från amerikaner och britter. Jag vet inte om jag egentligen vill flytta till ett helsvenskt område. Visst, det är problem här, men samtidigt är folk mer accepterande. Mina kompisar vill flytta, men de har glömt att i vissa svenska samhällen kommer de bli förföljda för att de är flator. Sådant händer inte här, trots att islamister är emot det. Det är väldigt mycket leva och låta leva. Vanliga människor är majoritet. Gäng är minoritet.
1567	2024-04-12	marcandrew	4432	Nej, svenskar är inte empatistörd. Det är TS som är en landsförrädare och inte fattar att folk till slut får nog.
1568	2024-04-12	Fullhora	750	Jösses vilken förvirrad stackare du är. Börjar först dilla om att avenskar som vill ha lagar och ordning som minskar mördandet, dom har "empatistörningar" enligt dig. När poliser och psykologer gör just det, minskar mördandet, då är det "gör sitt jobb". Sedan irrar du in på "SD-kort" och "utförsäljningen av det offentliga". Glömde du ta din medicin idag?
1569	2024-04-12	Q-Tron	658	Japp, det är de fredliga och civiliserade svenskarna som får skylla sig själva när gapiga, våldsamma och empatistörda invällare mördar, våldtar, rånar och spränger. Tack för utbildningen, professorn!
1570	2024-04-12	Doraemon-FTW	3430	Läs hela inlägget istället för att fultolka ett stycke. Personen presenterade många bra poänger - svenskarna är introverta och oupplysta, det utesluter inte att det är fel att begå brott. Det är lätt för en oupplyst svensk att tro att det är "invandrarnas kultur" att våldta och mörda, eftersom den oupplyste svensken inte vet något om andra kulturer än sin egen. Han förstår inte ens våra grannländers.
