id	mydate	author	posts	text
554	2018-01-19	SummerSecond	11	Alla ni som säger att Skåne skulle användas som hem för alla invandrare är helt jävla efterblivna! Det län som röstat emot vansinnesinvandringen från början men olyckligtvis fått massor av babbar placerade där trots det. Bättre att invandrarna får sin egen stat i de områden där man röstat fram massinvandringen Ni rödingar uppe i Norrland kan väl offra en del av er mark till invandrarna så de kan upprätta sin egen stat jämte samerna, eller varför inte Stockholmsområdet som vurmar så för invandrare med alla miljöpartister och annat feminazi slödder. Tvi! Föreslår att vi skickar alla missnöjda invandrare till Papua Nya Guinea, där kan de försöka upprätta sin egen stat. Tyckte dom att det var tufft i sitt hemland så kommer de längta hem igen som om det vore paradiset på jorden, för Papua är då fan det inte...
555	2018-01-19	4yoonly	9245	Kan vi inte bara kalla den för Malmö? Vi kan ju då utan några problem utvisa ur vår stat om det inte fungerar i Sverige och lagarna där får dom väl välja själva med att dom kommer bygga på Sharia är väl en självklarhet :-) Jag är givetvis ironisk... men ändå...
556	2018-01-19	BaronVonHelsing	6660	Skitbra idé! Som andra redan har påpekat så hade en mur behövts byggas, löser man det så är det ju klockrent. Vi slipper alla problem relaterade till invandring och invandrare i det här landet. En stor dröm ju! Detta argument kan ju lindas in i ett PK-skal också; "De stackars invandrarna är så förnedrade i Sverige att de förtjänar en egen stat. Vi bör också bygga en mur runt den staten så inga onda svennar kan ta sig in och förstöra."
557	2018-01-19	Manskahahusvagn	8052	I de länder de flesta av dem kommer från är det normalt att inte ha förtroende för myndigheter. Polisen är dessutom invandrarnas direkta fiender såtillvida att det är polisen som genomför tvångsavvisningar etc. Det är svenska statens myndigheter som bedömer asylskäl och därför också kan ses som invandrarfientliga. Man kan inte känna förtroende för dem som utvisar släktingar, vänner och grannar till misär, krig och död. Inget skulle hindra att Rinkeby eller Rosengård organiserade egna ordningsvakter och egen brandkår etc, tvärtom skulle det skapa meningsfulla arbetstillfällen.
558	2018-01-19	Cauvie	7459	Deras antal är för många. De utger väl ca. 3 miljoner invandrare nu i Sverige samtliga generationer inräknade. Jag tror de skulle behöva ett område i samma storlek som Skåne/Gotland. Bäst vi gör som Istvan säger annars åker vi på stryyk!
559	2018-01-19	klinkerhofen	11451	vi kan väl stycka av ett område i lappland? (Lappland Yta: 109 702 km²) lite övrig info som tyder på att det är glest befolkat "En polisbil ska täcka södra Lappland under vardagsnätter - ett område nästan lika stort som Danmark. " https://www.svt.se/nyheter/lokalt/va...sodra-lappland
560	2018-01-19	J39	1635	Istvan är väll ett ungerskt namn? Eller har jag fel?
561	2018-01-19	DasZebra	6	Men Sverige är inte som deras hemländer. De har ingen anknytning till någon svensk region som svenskar har... Det skulle bara spä på deras misär med sharia lagar och brott mot mänskliga rättigheter. Det invandrare ska få är två val. 1, Integrera sig till Sverige och respektera landet eller 2, åka till nåt annat land som passar dom bättre. Skrattretande att vi ska offra mark för några bortskämda snorvalpar som inte kan visa respekt och tacksamhet. DU är verkligen naiv som tror att detta är bra...
562	2018-01-19	svartellervitt	2022	Det är inte vi som står bakom politiken. SD är starkast här nere. Att allt pack som araber,juggar och stockholmare dras hit är inte vårt fel. Släpp Skåne,vi reder oss själva.
563	2018-01-19	InflatableBoppo	1601	Nu är svenska myndigheter och du fientligt inställd till flyktingar som ger asyl till migranter som saknar asylskäl Varför kan så kallade asylsökande åka hem på semester när asyl kommit på posten? Amir Nabizadeh njuter nu i Iran och umgås med släkten som han flydde ifrån. Sett till invånarantalet ger vi flest asyl inom EU med utvisningar som knappt äger rum. Jag som trodde lycksökare älskade det naiva myndighetssverige där man kan gå ifrån över 30år i hemlandet till 16år i Sverige. Enda anledningen att du inte vill ge lycksökare ett eget land inom Sverige är för att lycksökarna inte kan suga ut skattepengar ifrån skattebetalarna. Lågt förtroende för svenska myndigheter, högt förtroende för svenska bidrag och välfärd.
564	2018-01-19	petzor	1457	Tror du på tomten också? Lättaste är att skicka hem dem till djungelöknen där de kan ha siesta hela dagen utan att behöva dona med avancerade saker som luftkonditionering, element & källsortering. Eftersom det rör sig om stora volymer så kan man nog få rejäl rabatt hos flyg- & bussbolagen. Hade lätt gett upp flygresor under något år medan detta genomfördes.
565	2018-01-19	J39	1635	Håller inte med han förutom en sak att det är redan kört att integera dem eller att assimilera dem och inbördeskrig väntas runt hörnet.
566	2018-01-19	LaderKent	254	MENA männen och muslimerna kan annars åka hem till sin egna stat.
567	2018-01-19	retepm.	7141	Vilka fräcka jävlar här görs inga eftergifter. Det är vårt land inte ert. Vi är inte skyldiga er ett piss.
568	2018-01-19	Knivur-273	5219	Jag tycker att du är elak mot Skåningar, har aldrig hyst agg mot folk från något speciellt landskap. Jag tycker istället att de kan få Gotska Sandön som en egen fristat. Där finns mycket sand som i deras hemländer, tallar att bygga hus av och elda med, kaniner att äta, fiskemöjligheter och olika sorters fåglar att fånga. Men vänta bara tills de blir tillräckligt många, så kommer Svenska kommunister och annat löskefolk kräva att deras krav skall tillgodoses. Självklart kommer det krävas att det då riktiga Sverige försörjer deras nya "statsbildning", bygger deras hus, odlar deras mat och producerar deras energibehov.
569	2018-01-19	J39	1635	Jo. Vi är skydiga att få ut kräken.
570	2018-01-19	Manskahahusvagn	8052	Namnet du har cherrypickat är en ensamkommande afghan. Att han har möjlighet att träffa sin familj i Iran är väl bara något att glädjas åt. Men det var till Afghanistan han skulle utvisas och det är en helt annan fråga.
571	2018-01-19	Bellossom	1403	Exakt, vad sa PK-aposteln i ringP1? Snälla, säg att det var Täppas.
572	2018-01-19	J39	1635	Om du vill så kan du få följa med kulturberikanarna om du vill till deras vackra hemland. Du kan få en låda med bananer, en koran och en hundring av mig om du sticker.
573	2018-01-19	tclaesson	1293	Det lättaste är ju om de missnöjda parasiterna åker hem till sina egna kaosländer istället. Men visst kan vi ju ge upp en liten bit mark för detta experiment, med villkoret att den nya staten får klara sig helt och hållet på egen hand utan inblandning från Sverige. Den nya staten skulle förmodligen i ett sådant scenario kollapsa otroligt snabbt med massdöd som följd och vi kan därefter återta marken med en betydligt mindre mängd kaosmänniskor än innan att ta hand om. Det är ju bara att titta på våra förorter hur bra det går för att få en hint om hur läget i den här nya staten skulle vara. :)
574	2018-01-19	iceman555	22	Jag är för inbördeskriget
575	2018-01-19	Jof	12550	Jag skrev om ett liknade förslag så sent som igår. Vissa invandrare är svårintegrerade (och för all del, en del vill integrera dom). Som extrema judegrupper och romer. En del kineser. Gör som i USA bl a ge dom vissa kvarter där dom får sköta vissa saker som utbildning, sjukvård o liknande, men inte juridik, polisväsen, väg och vatten. DET funkar. Varför ska alla bli "svenskar". Låt alla blommor blomma, men under moder Sveas hand!
576	2018-01-19	Fashwave	1085	Mellan de två alternativen inbördeskrig och tvåstatslösning har jag bara en sak att säga: krig. Det där var det värsta jag hört på länge. Visar bara hur långtifrån Sverige lyckats integrera alla ekonomiska lycksökare. Det här måste spridas maximalt. Äkta och seriös reklam mot all invandring ö.h.t. Hur förnedrar Sverige dessa ekonomiska lycksökare? De får bidrag som ingen etnisk svensk är i närheten av, bostad, betald körkortsutbildning, retroaktivt barnbidrag och slipper jobba för att få allt detta som svensken måste slita ihop till och betala världens högsta skatt. Detta inslag i Ring P1 måste vara den bästa valreklamen på länge för SD sedan Mona Sahlin och Åsa Romson lämnade scenen. Att bara ha mage att föreslå tvåstatslösning. Det är helt sinnessjukt. När är det nog?
577	2018-01-19	Fashwave	1085	Inte Täppas Fågelholk. Var en kvinna och hon blev rätt tagen och överrumplad. Märktes att hon skämdes över vad kulturberikaren sa.
578	2018-01-19	InflatableBoppo	1601	Cherrypickat En central ledare för ungisverige som uppmärksammats av msm, fått över en halv miljon i donationer och vunnit priser. Asyl är till för flyktingar inte lyxmigranter som har ett bra liv i Iran och vill höja livskvalitén. Han har aldrig riskerat att utvisas till Afghanistan om han inte sökt asyl på falska grunder i Sverige. Nu belönar sig dock bedrägeri.
579	2018-01-19	PappasNyaKille	5159	Jag tycker Istvans lösning låter bra! Alla bidragstagare, extremister och kriminella till land 2 uppe i fjällen, där de får klara sig själva (men inte avvika). De skötsamma och sekulära stannar hos oss.
580	2018-01-19	stahlhelm1916	509	malmö kan dom få. kanske resten av södra sverige också. vilket paradis det kommer bli, det stället
581	2018-01-19	stone_sleeper	4286	Istvan (en ungrare?) bör inte dricka så tidigt på morgonen.
582	2018-01-19	MikeHanlon	3004	Bor det fortfarande svenskar i Malmö?
583	2018-01-19	kraftfoder	28905	Undrar hur han krånglade igenom sig censur-slussen? Han kanske sa att han skulle prata om ett ämne men tog upp ett helt annan när han kom fram?
584	2018-01-19	RZLA	1353	Att sätta invällarna i ghetton och sedemera "arbetsläger", är en mycket bättre idé. Svensken har rätt till sitt eget land, icke-svenskar har ingen rätt till landet.
585	2018-01-19	energica	438	Det var väl inte så här vi svenskar/ invandrare ville ha det från början. Ett samhälle för vita och ett för svarta. Helt avskilt och fientligt. Konstig människa den där Istvan. Bättre att lära känna varandra bo blandat, ha gemensamma fester och måltider. Dom lär sej svenska och våra traditioner. Vi lär oss deras traditioner , kultur och matlagning .Och dom som inte vill får väl bo i segrerade områden svenskar som invandrare. Förresten hur många år ska man bo i Sverige för att bli svensk egentligen?? Freijj
586	2018-01-19	A-party-with-marty	2242	Måste isf varit en ungersk förlorare i Sverige (kan han va tattare nä?). Annars är ju Ungern ett nationalistiskt land (dock säljer sig landets kvinnor ofta till högstbjudande oavsett ursprung). Tror inte han är så representativ iaf. Var faktiskt en del andra invandrare som dissade honom ska medges.
587	2018-01-19	J39	1635	Om det är från närligande länder som deler liknade kultur, religion och är slaver,kelter,balter och germaner så kan de bli etniska svenskar efter nåra generationer. Om du inte är det kan du aldrig bli helsvensk.
588	2018-01-19	A-party-with-marty	2242	Ja visst är det trevligt att kunna bjuda på sitt land etc så att mångkulturella tendenser (även med religiös präge) frodas.
589	2018-01-19	LuluBrooksie	24915	Och en annan sak! Om detta blir verklighet en dag hoppas jag faktiskt att man drar upp VARENDA MOSKÉ I DETTA LAND MED RÖTTERNA OCH omplanterar dom i "Nya MENA" eller vad landet nu skulle heta. Inga moskéer på våra gator!
590	2018-01-19	borskungen	12384	Vi kan ge blattarna en del av Norrlands inland så får de klara sig själva där. Det blir väl kaos inom en vecka och sedan söker de asyl i Sverige igen...
591	2018-01-19	kroppskultur	10417	Jag måste tyvärr anse att det är en bra idé, det är bättre att en mindre del av landet förvandlas till något som påminner om deras ursprungsländer än att hela landet gör det.
592	2018-01-19	NickSonny	2980	Jag tycker man kan lära sig ett och annat av andra länder som har en stor och högljudd muslimsk minoritet. Det fungerar inte att låta dem komma undan med att skita i att ta seden dit de kommer. Gör man det kommer de alltid med krav på separata badtider, separata lagar och till slut krav på egen stat. Det finns inga länder där det inte skett förutom länder där man håller muslimerna jävligt kort. Deportera fanskapen eller avliva dem. Jag skiter i vilket. Gör vi inte det får vi inbördeskrig inom 100 år och då kommer NATO och bombar oss, precis som de bombade serberna, så att jihadisterna kunde få sitt territorium.
593	2018-01-19	BlackBooks	2684	Invandrarna har inte lyckats stanna och försvara sina egna länder så hur har dom tänkt att kunna försvara en egen stat inom Sveriges gränser? Jag förväntar mig att de INTE ska parasitisera på Sveriges system! Bästa hade varit om invandrare som Istvan i inslaget tog sig tillbaka till sina ursprungsländer och tar tag i problemen och bygger upp på nytt. Lata jävlar som bara ska ha allt serverat av värdländerna. Jag hatar det mesta och detta är inte fantastiskt.
594	2018-01-19	Jof	12550	Dom kan få Rinkeby!
595	2018-01-19	Woodsmoke	1397	De HAR redan Rinkeby. Till och med jag, som enbart är halvt PK och född sosse (som nyktrat till) misstrodde en bekant till mig som redan för många år sedan påtalade att vi kommer mista territorium till islam.
596	2018-01-19	Jof	12550	Låt dom få en egen flagga, kanske eget polisväsen. Dom kan få ett mandat i riksdagen.
597	2018-01-19	Woodsmoke	1397	Varför? Exakt jävla varför ska de "få" detta? De ska anpassa sig eller dra åt helvete. Här är en linje. Det är Sveriges gräns. Är du på samma sida om den som mig? Då följer du svensk lag och norm. Annars ska du över till andra sidan, sen skiter jag fullständigt i vad som händer med dig.
598	2018-01-19	drwadde	551	Hehe. Det lågintensiva inbördeskriget skymtas kring hörnet. Jag vet inte vad mer för ledtrådar man behöver om att en del folk är här för att ta över. All makt åt Löfven, våran svetsare och befriare !
599	2018-01-19	Jof	12550	Utanför Rinkeby kan vara en no-go-zon för dom.
600	2018-01-19	Pelle000	1075	Mitten av Norrland och att dom kan börja från noll. (Finnarna i Orsa finnmark) och nybyggarna i usa hade typ inget. Dom skulle förstås börja kriga mot varandra ganska omgående.
601	2018-01-19	Woodsmoke	1397	Sydamerikanskt fängelse? Bygg en fet mur hindra allt från att komma igenom? Släng in varenda sandpåse som jiddrar?
602	2018-01-19	Pelle000	1075	Liberalerna kommer säkert rösta för det i framtiden tanke på deras tidigare knas idéer som att avskaffa Sverige som nation. Var väll nån som föreslog månggifte förut också.
603	2018-01-19	MelPoomene	930	Skrattretande. Om de var ovilliga till att kriga för sitt fosterland så kommer inte utlänningarna kunna enas och kriga för ett eget land på ett nytt fientligt territorum i det karga Norden. I am a pathological hypervigilant. What's Your excuse?!
604	2018-01-19	A-party-with-marty	2242	Har ni noterat att Expressen dragit gång en ny kampanj för invandrare #no strangers # typ. Dvs mot rasism bla bla. Nån statestik på brot mot svenskar etc har jag dock ej sätt som jämförelse mm.
605	2018-01-19	joshmark	1030	Jag tar hellre ett inbördeskrig. Och löser problemet permanent.
606	2018-01-19	Pelle000	1075	Bra idé! I stället att vi måste bygga murar/inhängnat/stängsel/mera kameror för att hålla dessa borta så bygg runt no go zoner Jag är inte rasist bara jävligt förbannad.
607	2018-01-19	Fashwave	1085	Hur kan man inte uppfatta det som ett hot? Tvåstatslösning eller inbördeskrig?
608	2018-01-19	Pripps3.5	15274	Vi är döda och plundrade, med elitens goda minne.
609	2018-01-19	Bob-Dylan	2134	Det finns inte och kommer inte finnas en lösning på invandringsfrågan! Förstår inte att det diskuteras i oändlighet. Sverige har s.a.s kastat hatten över muren och det är bara att hoppa över ! Inbördeskrig eller total misär är två utfall. Mest troligt total misär då svenskarna är för fega och aldrig kommer gå ut på gatan och göra något åt saken! Gällande den förbannade blatten som kom med det förslaget så hoppas jag att han blir påkörd av en buss.
610	2018-01-19	Nekro.	2928	Sveraq, Svenistan, Nordistan, man kan spinna på länge om detta.
611	2018-01-19	pjabas	4455	Jaha, jag föreslår istället att Stockholm tvångsisoleras och hela landets avloppssystem i ett enormt jobbskapande pipelineprojekt leds till Stockholms gräns där skiten pumpas upp i höga torn som omringar staden och blåses ut som en aerosol på den sida vinden blåser mot stan. "Vi har varit naiva" /Empat-maskerad sociopat-politiker
612	2018-01-19	kraftfoder	28905	De har redan mandat i riksdagen, betydligt fler än ett: Vid en snabbkoll (baserat på namn helt ovetenskapligt) får jag antalet till 22-23. Cirka 6,3% av antalet ledamöter alltså. Hade de räknats som ett parti, hade de varit i storleksordningen på ett ungefär MP, C, MP, KDS, VPK, dvs. något i den stilen. Källa: http://www.riksdagen.se/sv/ledamoter-partier/
613	2018-01-19	TerjeWendtCompello	701	Den här visade otacksamheten har varit ett återkommande tema; Inte nog med att dom fysiskt angriper svenskar i hela samhället, man pumpar även ut sådana media utspel gång på gång. "Svenskar ska tacka mig för att jag kom till Sverige" Hela inställningen är att svenskar är några slags tjänare som ska försörja och tjäna dom Svennebögen ska veta sin plats. Detta pågrund av en kombination av klanmentalitet och att vänster etablissemanget ständigt pumpat i dom att svenskar är onda, invandrare offer och förtjänar därmed bättre behandling. Värst misstänker jag att det är för svensk skolelever som idag är en minoritet i de flesta skolor.
614	2018-01-19	stone_sleeper	4286	Hanif Bali blir statsministern i invandrarstaten. Den svenska delstaten får.... Gustav Fridolin, och satsar på att bli en humanitär stormakt.
615	2018-01-19	Akvileja	921	Jag tycker Istvan låter mer som en rättshaverist. Han har bott 43 år i Sverige, men har aldrig fått rätt mot myndigheterna. Det finns nog många svenskar som kan säga detsamma. Vad jag förstår vill han inte ha en fysisk uppdelning av landet och samma svenska lagar ska gälla för alla. Däremot vill han ha särskild polis- och skattemyndighet för invandrare, eget rättsväsende. Samma lagstiftning skall tydligen tillämpas olika beroende på etnisk tillhörighet. Jag tror inte att han som europé (ungrare?) skulle trivas bättre med att styras av araber och somalier, men han liksom flertalet här tänker inte långt innan han hasplar ur sig.
616	2018-01-19	franskanalfabet	345	om man släpper vapnena fria så man kan försvara sig så borde man kunna driva bort dem. detta är ju lågbegåvade som parkerat sig på livslånga bidrag (låg intelligens).
617	2018-01-19	franskanalfabet	345	tycker att han ska flytta hem till Ungern, där han kommer ifrån så kan han få alla rättigheter han har rätt till. Om man har rätt och är påläst så får man rätt.
618	2018-01-19	NocturnalVoodoo	2033	Äntligen någon med riktiga visioner.. Vart skriver jag på
619	2018-01-19	Sam.Boyd	24981	En utmärkt lösning. Två stater: 1. Konungariket Sverige. 2. Norra kalifatet. Sverige får arbetsro och har råd att betala bistånd och skatt till kallifatet.
620	2018-01-19	Detanvändarnam	321	Skitsnack på hög nivå.Ett jävla tjatande om kommuniststat hit och socialiststat dit. Vi lever i en genomkapitalistisk stat värre en USA i vissa fall.Högerpolitik har förts sedan början på åttiotalet.Högern har till fullo lyckats med att slå sönder välfärdssamhället,invandring och Eu medlemskap har varit de främsta verktygen.Reinfeldt med företrädare är bara att gratulera till väl lyckat genomfört projekt.Varför har Moderater alltid verkat och varit pådrivande för ett medlemskap i EU kan man ju fundera över? ett byråkratprojekt som är i klass med det gamla sovjet.Då är inte individens frihet så väldigt viktigt längre, bättre då med fri invandring och billig arbetskragt från öst.Ökad kriminalitet är smällar man får ta enligt Reinfeldt med vänner.
621	2018-01-19	thegoodshepherd	2380	Många som tycker dom kan få Skåne. Jag säger fuck off och ge dom Stockholm det är ni som fuckat up det är ju knappast från Skåne idiot ideerna med öppna gränser kom från, dessutom kommer vi i Malmö skicka tillbaka alla Sthlmsmuppar som springer rundor på Möllan och resten av staden med sitt jävla vego, feminist, godhets trams. Känns som om alla sthlms socialistfittor har flyttat till Malmö och förstör staden med sina utopiska socialist ideer. Alla secondhandbutiker, alla vegobutiker, alla tramsbutiker man vet kommer lägga ner några månader senare.... alla är drivna av stockolmare och fyllda med stockholmare. Det är ni era jävla 08or som är problemet det är ni som driver på alla idiot ideer som ska vara gratis och alla ska ha bidrag och sedan tvingar ni resten av Sverige betala för att NI gör Malmö till en jävla magnet av skitmänniskor. Ni ska bort och ni ska bort absolut först, sen skickar vi resten av idiotblattarna till Sthlm och stänger vår gräns. "Deception is a state of mind and the mind of the State"
622	2018-01-19	Verkisto2	712	Precis så är det. Så enkelt och så sant. Nu förstår "värddjuret" inte detta, istället skylls alla misslyckanden på just värddjuret. Parasiterna förstår inte bättre än så. Vi, dvs värddjuret, kan välja om vi vill låta parasiterna fortsätta suga ut oss eller om vi vill skaka av oss parasiterna.
623	2018-01-19	Egnatankar	4980	Jag håller med dig till hälften. Jag tror att Reinfeldt såg invandringen som ett sätt att försvaga den av honom så avskydda välfärdsstaten. Att han dessutom sänkte en massa skatter, först och främst för höginkomsttagare, gjorde förstås att välfärden fick mindre inkomster att röra sig med samtidigt som den fick en massa nya utgifter i form av nya invandrare att ta hand om.
624	2018-01-19	Fashwave	1085	För du glömde bort Göran Persson och Stefan Löfven bara så där. Haha. Genomkapitalistisk? Sverige? Haha.
625	2018-01-19	Fashwave	1085	Skåne är Skåne. Det bästa med Sverige.
626	2018-01-19	Panzershreck	861	Istvan har rätt vad gäller psyket hos babbarna men Sverige tillhör svenskarna och skall inte delas upp. Skicka ut babbarna istället.
627	2018-01-19	climasol	16119	Ja detta har jag själv tänkt på många gånger. Att skapa några enklaver eller hemländer där invandrarna kan bo. De får naturligtvis försörja sig själva efter bästa förmåga. Detta är nog den absolut bästa lösningen för integration fungerar inte när det gäller framför allt muslimer. Jag tror dessutom att de skulle trivas bättre om de fick leva helt separerade från det svenska samhället. Ifall många invandrare håller med denna man så skall vi vara väldigt glada.
628	2018-01-19	Lagertha	6272	Istvan och alla andra babbar kan ta hela Öland om de vill. De hatar alla andra raser och kan inte ens hålla sams med sina egna. Dessutom klarar de brightaste av dem på sin höjd att odla nån grönsaker. Hur lång tid hade det tagit innan de första flyktingarna från Öland kommit i stulna båtar med sina kvinnor och barn kvar på Öland. En vecka??
629	2018-01-19	Valpen_	9538	Invandrarna i Sverige är ingen homogen grupp, Sverige behöver nog minst en tiostatslösning, forna Jugoslavien blev sju stater för att göra en jämförelse.
630	2018-01-19	climasol	16119	Gazaremsan i Israel har en folktäthet 5000 per kvadratkilometer. Där bor det ungefär 2 miljoner araber och ytan är 365 km2. Jag tror detta skulle vara tillräckligt för de värsta invandrarna i Sverige. Vi har en yta på 450.000 km2. Det innebär att vi skulle tvingas avstå mindre än en promille av ytan. Detta skulle jag säga ja till utan tvekan.
631	2018-01-19	Pitschka	1529	Skitsnack. Ni skåningar är kroniskt elaka, fördömande och djävligt ohjälpsamma mot resten av oss Svenskar. Vete fan om det är något medfött eller något i ert djävla kalkvatten ni är uppfödda på. Jag fattar inte hur fan man konstant måste per automatik vara avvisande mot resten av ett lands befolkning man de facto tillhör. Men ok, nu har vi fyllt ert jävla län med mänsklighetens absoluta bottenskrap, och snart finns det inte budgetutrymme för några tre-fyra miljarder i bidrag.
632	2018-01-19	Knivur-273	5219	Du förstår inte ens de grövre nyanserna i det Svenska språket din odugling. Jag är icke skåning, men kunde likaväl vara en dylik. Ditt namn säger väl en del. Måhända europeisk, det är gott, men inte allt. Mitt användarnamn är förvisso icke Svenskt, men anknyter. Pitschka, du skriver om "blyerts" också ? Jag känner ditt skrivsätt. Du är i trollfabriken vad ?
633	2018-01-19	RebelWithACause	432	Söndra och härska det lyckades globalisterna med väst och nog var det på tiden attt västerlänningar får känna på misär dom skapar i världen.
